Title,URL,Description,Details,ShortDetails,Resource,Type,Identifiers,Db,EntrezUID,Properties
"R5 and X4 HIV viruses differentially modulate host gene expression in resting CD4+ T cells.","/pubmed/18327980","Sirois M, Robitaille L, Sasik R, Estaquier J, Fortin J, Corbeil J.","AIDS Res Hum Retroviruses. 2008 Mar;24(3):485-93. doi: 10.1089/aid.2007.0120.","AIDS Res Hum Retroviruses.  2008","PubMed","citation","PMID:18327980","pubmed","18327980","create date:2008/03/11 | first author:Sirois M",
"Rampant polyuridylylation of plastid gene transcripts in the dinoflagellate Lingulodinium.","/pubmed/16434702","Wang Y, Morse D.","Nucleic Acids Res. 2006 Jan 24;34(2):613-9. Print 2006.","Nucleic Acids Res.  2006","PubMed","citation","PMID:16434702 | PMCID:PMC1351369","pubmed","16434702","create date:2006/01/26 | first author:Wang Y",
"Rapamycin reduces fibroblast proliferation without causing quiescence and induces STAT5A/B-mediated cytokine production.","/pubmed/26652669","Gillespie ZE, MacKay K, Sander M, Trost B, Dawicki W, Wickramarathna A, Gordon J, Eramian M, Kill IR, Bridger JM, Kusalik A, Mitchell JA, Eskiw CH.","Nucleus. 2015;6(6):490-506. doi: 10.1080/19491034.2015.1128610.","Nucleus.  2015","PubMed","citation","PMID:26652669 | PMCID:PMC4915505","pubmed","26652669","create date:2015/12/15 | first author:Gillespie ZE",
"Rapid dopaminergic modulation of the fish hypothalamic transcriptome and proteome.","/pubmed/20808832","Popesku JT, Martyniuk CJ, Denslow ND, Trudeau VL.","PLoS One. 2010 Aug 20;5(8):e12338. doi: 10.1371/journal.pone.0012338.","PLoS One.  2010","PubMed","citation","PMID:20808832 | PMCID:PMC2924890","pubmed","20808832","create date:2010/09/03 | first author:Popesku JT",
"Rapidly cleaving bovine two-cell embryos have better developmental potential and a distinctive mRNA pattern.","/pubmed/24285591","Orozco-Lucero E, Dufort I, Robert C, Sirard MA.","Mol Reprod Dev. 2014 Jan;81(1):31-41. doi: 10.1002/mrd.22278. Epub 2013 Nov 27.","Mol Reprod Dev.  2014","PubMed","citation","PMID:24285591","pubmed","24285591","create date:2013/11/29 | first author:Orozco-Lucero E",
"Rare de novo deletion of metabotropic glutamate receptor 7 (GRM7) gene in a patient with autism spectrum disorder.","/pubmed/25921429","Liu Y, Zhang Y, Zhao D, Dong R, Yang X, Tammimies K, Uddin M, Scherer SW, Gai Z.","Am J Med Genet B Neuropsychiatr Genet. 2015 Jun;168B(4):258-64. doi: 10.1002/ajmg.b.32306. Epub 2015 Apr 29.","Am J Med Genet B Neuropsychiatr Genet.  2015","PubMed","citation","PMID:25921429","pubmed","25921429","create date:2015/04/30 | first author:Liu Y",
"RBM10 promotes transformation-associated processes in small cell lung cancer and is directly regulated by RBM5.","/pubmed/28662214","Loiselle JJ, Roy JG, Sutherland LC.","PLoS One. 2017 Jun 29;12(6):e0180258. doi: 10.1371/journal.pone.0180258. eCollection 2017.","PLoS One.  2017","PubMed","citation","PMID:28662214 | PMCID:PMC5491171","pubmed","28662214","create date:2017/07/01 | first author:Loiselle JJ",
"RBM5 reduces small cell lung cancer growth, increases cisplatin sensitivity and regulates key transformation-associated pathways.","/pubmed/27957556","Loiselle JJ, Roy JG, Sutherland LC.","Heliyon. 2016 Nov 29;2(11):e00204. eCollection 2016 Nov.","Heliyon.  2016","PubMed","citation","PMID:27957556 | PMCID:PMC5133678","pubmed","27957556","create date:2016/12/14 | first author:Loiselle JJ",
"RBM6-RBM5 transcription-induced chimeras are differentially expressed in tumours.","/pubmed/17908320","Wang K, Ubriaco G, Sutherland LC.","BMC Genomics. 2007 Oct 1;8:348.","BMC Genomics.  2007","PubMed","citation","PMID:17908320 | PMCID:PMC2174484","pubmed","17908320","create date:2007/10/03 | first author:Wang K",
"An RCOR1 loss-associated gene expression signature identifies a prognostically significant DLBCL subgroup.","/pubmed/25395426","Chan FC, Telenius A, Healy S, Ben-Neriah S, Mottok A, Lim R, Drake M, Hu S, Ding J, Ha G, Scott DW, Kridel R, Bashashati A, Rogic S, Johnson N, Morin RD, Rimsza LM, Sehn L, Connors JM, Marra MA, Gascoyne RD, Shah SP, et al.","Blood. 2015 Feb 5;125(6):959-66. doi: 10.1182/blood-2013-06-507152. Epub 2014 Nov 13.","Blood.  2015","PubMed","citation","PMID:25395426","pubmed","25395426","create date:2014/11/15 | first author:Chan FC",
"Re-analysis of omics data indicates Smithella may degrade alkanes by addition to fumarate under methanogenic conditions.","/pubmed/24865771","Tan B, Nesbø C, Foght J.","ISME J. 2014 Dec;8(12):2353-6. doi: 10.1038/ismej.2014.87. Epub 2014 May 27. No abstract available. ","ISME J.  2014","PubMed","citation","PMID:24865771 | PMCID:PMC4260707","pubmed","24865771","create date:2014/05/29 | first author:Tan B",
"Re-evaluation of hepatitis B virus clinical phases by systems biology identifies unappreciated roles for the innate immune response and B cells.","/pubmed/25808668","Vanwolleghem T, Hou J, van Oord G, Andeweg AC, Osterhaus AD, Pas SD, Janssen HL, Boonstra A.","Hepatology. 2015 Jul;62(1):87-100. doi: 10.1002/hep.27805. Epub 2015 Apr 27.","Hepatology.  2015","PubMed","citation","PMID:25808668","pubmed","25808668","create date:2015/03/27 | first author:Vanwolleghem T",
"Recent Developments in Using Advanced Sequencing Technologies for the Genomic Studies of Lignin and Cellulose Degrading Microorganisms.","/pubmed/26884714","Kameshwar AK, Qin W.","Int J Biol Sci. 2016 Jan 1;12(2):156-71. doi: 10.7150/ijbs.13537. eCollection 2016. Review.","Int J Biol Sci.  2016","PubMed","citation","PMID:26884714 | PMCID:PMC4737673","pubmed","26884714","create date:2016/02/18 | first author:Kameshwar AK",
"Recent nonhybrid origin of sunflower ecotypes in a novel habitat.","/pubmed/23072494","Andrew RL, Kane NC, Baute GJ, Grassa CJ, Rieseberg LH.","Mol Ecol. 2013 Feb;22(3):799-813. doi: 10.1111/mec.12038. Epub 2012 Oct 16.","Mol Ecol.  2013","PubMed","citation","PMID:23072494","pubmed","23072494","create date:2012/10/18 | first author:Andrew RL",
"Recessive mutations in the kinase ZAK cause a congenital myopathy with fibre type disproportion.","/pubmed/27816943","Vasli N, Harris E, Karamchandani J, Bareke E, Majewski J, Romero NB, Stojkovic T, Barresi R, Tasfaout H, Charlton R, Malfatti E, Bohm J, Marini-Bettolo C, Choquet K, Dicaire MJ, Shao YH, Topf A, O'Ferrall E, Eymard B, Straub V, Blanco G, Lochmüller H, et al.","Brain. 2017 Jan;140(Pt 1):37-48. doi: 10.1093/brain/aww257. Epub 2016 Nov 5.","Brain.  2017","PubMed","citation","PMID:27816943 | PMCID:PMC5226058","pubmed","27816943","create date:2016/11/07 | first author:Vasli N",
"Reconstructing the suberin pathway in poplar by chemical and transcriptomic analysis of bark tissues.","/pubmed/28575526","Rains MK, Gardiyehewa de Silva ND, Molina I.","Tree Physiol. 2017 Jun 1:1-22. doi: 10.1093/treephys/tpx060. [Epub ahead of print]","Tree Physiol.  2017","PubMed","citation","PMID:28575526","pubmed","28575526","create date:2017/06/03 | first author:Rains MK",
"Recovering complete mitochondrial genome sequences from RNA-Seq: A case study of Polytomella non-photosynthetic green algae.","/pubmed/26860338","Tian Y, Smith DR.","Mol Phylogenet Evol. 2016 May;98:57-62. doi: 10.1016/j.ympev.2016.01.017. Epub 2016 Feb 6.","Mol Phylogenet Evol.  2016","PubMed","citation","PMID:26860338","pubmed","26860338","create date:2016/02/11 | first author:Tian Y",
Title,URL,Description,Details,ShortDetails,Resource,Type,Identifiers,Db,EntrezUID,Properties
"Recurrent loss of sex is associated with accumulation of deleterious mutations in Oenothera.","/pubmed/25534028","Hollister JD, Greiner S, Wang W, Wang J, Zhang Y, Wong GK, Wright SI, Johnson MT.","Mol Biol Evol. 2015 Apr;32(4):896-905. doi: 10.1093/molbev/msu345. Epub 2014 Dec 21.","Mol Biol Evol.  2015","PubMed","citation","PMID:25534028","pubmed","25534028","create date:2014/12/24 | first author:Hollister JD",
"Recurrent somatic mutations of PTPN1 in primary mediastinal B cell lymphoma and Hodgkin lymphoma.","/pubmed/24531327","Gunawardana J, Chan FC, Telenius A, Woolcock B, Kridel R, Tan KL, Ben-Neriah S, Mottok A, Lim RS, Boyle M, Rogic S, Rimsza LM, Guiter C, Leroy K, Gaulard P, Haioun C, Marra MA, Savage KJ, Connors JM, Shah SP, Gascoyne RD, Steidl C.","Nat Genet. 2014 Apr;46(4):329-35. doi: 10.1038/ng.2900. Epub 2014 Feb 16.","Nat Genet.  2014","PubMed","citation","PMID:24531327","pubmed","24531327","create date:2014/02/18 | first author:Gunawardana J",
"Recurrent targets of aberrant somatic hypermutation in lymphoma.","/pubmed/23131835","Khodabakhshi AH, Morin RD, Fejes AP, Mungall AJ, Mungall KL, Bolger-Munro M, Johnson NA, Connors JM, Gascoyne RD, Marra MA, Birol I, Jones SJ.","Oncotarget. 2012 Nov;3(11):1308-19.","Oncotarget.  2012","PubMed","citation","PMID:23131835 | PMCID:PMC3717795","pubmed","23131835","create date:2012/11/08 | first author:Khodabakhshi AH",
"Reduced BRCA1 transcript levels in freshly isolated blood leukocytes from BRCA1 mutation carriers is mutation specific.","/pubmed/27534398","Chehade R, Pettapiece-Phillips R, Salmena L, Kotlyar M, Jurisica I, Narod SA, Akbari MR, Kotsopoulos J.","Breast Cancer Res. 2016 Aug 17;18(1):87. doi: 10.1186/s13058-016-0739-8.","Breast Cancer Res.  2016","PubMed","citation","PMID:27534398 | PMCID:PMC4989508","pubmed","27534398","create date:2016/08/19 | first author:Chehade R",
"Reduced expression of antigenic proteins MPB70 and MPB83 in Mycobacterium bovis BCG strains due to a start codon mutation in sigK.","/pubmed/15882422","Charlet D, Mostowy S, Alexander D, Sit L, Wiker HG, Behr MA.","Mol Microbiol. 2005 Jun;56(5):1302-13.","Mol Microbiol.  2005","PubMed","citation","PMID:15882422","pubmed","15882422","create date:2005/05/11 | first author:Charlet D",
"Reduced ING1 levels in breast cancer promotes metastasis.","/pubmed/24962136","Thakur S, Singla AK, Chen J, Tran U, Yang Y, Salazar C, Magliocco A, Klimowicz A, Jirik F, Riabowol K.","Oncotarget. 2014 Jun 30;5(12):4244-56.","Oncotarget.  2014","PubMed","citation","PMID:24962136 | PMCID:PMC4147320","pubmed","24962136","create date:2014/06/26 | first author:Thakur S",
"Reduced Insulin Production Relieves Endoplasmic Reticulum Stress and Induces β Cell Proliferation.","/pubmed/26626461","Szabat M, Page MM, Panzhinskiy E, Skovsø S, Mojibian M, Fernandez-Tajes J, Bruin JE, Bround MJ, Lee JT, Xu EE, Taghizadeh F, O'Dwyer S, van de Bunt M, Moon KM, Sinha S, Han J, Fan Y, Lynn FC, Trucco M, Borchers CH, Foster LJ, Nislow C, et al.","Cell Metab. 2016 Jan 12;23(1):179-93. doi: 10.1016/j.cmet.2015.10.016. Epub 2015 Nov 25.","Cell Metab.  2016","PubMed","citation","PMID:26626461","pubmed","26626461","create date:2015/12/03 | first author:Szabat M",
"Reduced nuclear genomes maintain high gene transcription levels.","/pubmed/24336878","Tanifuji G, Onodera NT, Moore CE, Archibald JM.","Mol Biol Evol. 2014 Mar;31(3):625-35. doi: 10.1093/molbev/mst254. Epub 2013 Dec 12.","Mol Biol Evol.  2014","PubMed","citation","PMID:24336878","pubmed","24336878","create date:2013/12/18 | first author:Tanifuji G",
"Refined analysis of the Campylobacter jejuni iron-dependent/independent Fur- and PerR-transcriptomes.","/pubmed/26141822","Butcher J, Handley RA, van Vliet AH, Stintzi A.","BMC Genomics. 2015 Jul 4;16:498. doi: 10.1186/s12864-015-1661-7.","BMC Genomics.  2015","PubMed","citation","PMID:26141822 | PMCID:PMC4491227","pubmed","26141822","create date:2015/07/05 | first author:Butcher J",
"Regenerating 1 and 3b gene expression in the pancreas of type 2 diabetic Goto-Kakizaki (GK) rats.","/pubmed/24587207","Calderari S, Irminger JC, Giroix MH, Ehses JA, Gangnerau MN, Coulaud J, Rickenbach K, Gauguier D, Halban P, Serradas P, Homo-Delarche F.","PLoS One. 2014 Feb 26;9(2):e90045. doi: 10.1371/journal.pone.0090045. eCollection 2014.","PLoS One.  2014","PubMed","citation","PMID:24587207 | PMCID:PMC3936001","pubmed","24587207","create date:2014/03/04 | first author:Calderari S",
"Regional changes in gene expression after limbic kindling.","/pubmed/21424270","Corcoran ME, Kroes RA, Burgdorf JS, Moskal JR.","Cell Mol Neurobiol. 2011 Aug;31(6):819-34. doi: 10.1007/s10571-011-9672-7. Epub 2011 Mar 19.","Cell Mol Neurobiol.  2011","PubMed","citation","PMID:21424270","pubmed","21424270","create date:2011/03/23 | first author:Corcoran ME",
"Regional ion channel gene expression heterogeneity and ventricular fibrillation dynamics in human hearts.","/pubmed/24427266","Sivagangabalan G, Nazzari H, Bignolais O, Maguy A, Naud P, Farid T, Massé S, Gaborit N, Varro A, Nair K, Backx P, Vigmond E, Nattel S, Demolombe S, Nanthakumar K.","PLoS One. 2014 Jan 10;9(1):e82179. doi: 10.1371/journal.pone.0082179. eCollection 2014.","PLoS One.  2014","PubMed","citation","PMID:24427266 | PMCID:PMC3888386","pubmed","24427266","create date:2014/01/16 | first author:Sivagangabalan G",
"Regulating cytoplasmic oxalate homeostasis by Acyl activating enzyme3 is critical for plant Al tolerance.","/pubmed/28045586","Chen WW, Fan W, Lou HQ, Yang JL, Zheng SJ.","Plant Signal Behav. 2017 Jan 2;12(1):e1276688. doi: 10.1080/15592324.2016.1276688.","Plant Signal Behav.  2017","PubMed","citation","PMID:28045586 | PMCID:PMC5289516","pubmed","28045586","create date:2017/01/04 | first author:Chen WW",
"Regulation and Function of Maternal Gene Products During the Maternal-to-Zygotic Transition in Drosophila.","/pubmed/26358870","Laver JD, Marsolais AJ, Smibert CA, Lipshitz HD.","Curr Top Dev Biol. 2015;113:43-84. doi: 10.1016/bs.ctdb.2015.06.007. Epub 2015 Aug 14. Review.","Curr Top Dev Biol.  2015","PubMed","citation","PMID:26358870","pubmed","26358870","create date:2015/09/12 | first author:Laver JD",
"Regulation of bacteriocin production and cell death by the VicRK signaling system in Streptococcus mutans.","/pubmed/22228735","Senadheera DB, Cordova M, Ayala EA, Chávez de Paz LE, Singh K, Downey JS, Svensäter G, Goodman SD, Cvitkovitch DG.","J Bacteriol. 2012 Mar;194(6):1307-16. doi: 10.1128/JB.06071-11. Epub 2012 Jan 6.","J Bacteriol.  2012","PubMed","citation","PMID:22228735 | PMCID:PMC3294852","pubmed","22228735","create date:2012/01/10 | first author:Senadheera DB",
"Regulation of chromatin structure via histone post-translational modification and the link to carcinogenesis.","/pubmed/23609752","Thompson LL, Guppy BJ, Sawchuk L, Davie JR, McManus KJ.","Cancer Metastasis Rev. 2013 Dec;32(3-4):363-76. doi: 10.1007/s10555-013-9434-8. Review.","Cancer Metastasis Rev.  2013","PubMed","citation","PMID:23609752","pubmed","23609752","create date:2013/04/24 | first author:Thompson LL",
"Regulation of kynurenine biosynthesis during influenza virus infection.","/pubmed/27860276","Gaelings L, Söderholm S, Bugai A, Fu Y, Nandania J, Schepens B, Lorey MB, Tynell J, Vande Ginste L, Le Goffic R, Miller MS, Kuisma M, Marjomäki V, De Brabander J, Matikainen S, Nyman TA, Bamford DH, Saelens X, Julkunen I, Paavilainen H, Hukkanen V, Velagapudi V, et al.","FEBS J. 2017 Jan;284(2):222-236. doi: 10.1111/febs.13966. Epub 2016 Dec 14.","FEBS J.  2017","PubMed","citation","PMID:27860276","pubmed","27860276","create date:2016/11/20 | first author:Gaelings L",
"Regulation of pituitary gene expression by adrenalectomy.","/pubmed/19107126","Nishida Y, Yoshioka M, Ray CA, Bolduc C, Tanaka H, St-Amand J.","Obesity (Silver Spring). 2009 Jan;17(1):114-20. doi: 10.1038/oby.2008.484. Epub 2008 Oct 30.","Obesity (Silver Spring).  2009","PubMed","citation","PMID:19107126","pubmed","19107126","create date:2008/12/25 | first author:Nishida Y",
"Regulation of skeletal muscle transcriptome in elderly men after 6 weeks of endurance training at lactate threshold intensity.","/pubmed/20813182","Riedl I, Yoshioka M, Nishida Y, Tobina T, Paradis R, Shono N, Tanaka H, St-Amand J.","Exp Gerontol. 2010 Nov;45(11):896-903. doi: 10.1016/j.exger.2010.08.014. Epub 2010 Sep 8.","Exp Gerontol.  2010","PubMed","citation","PMID:20813182","pubmed","20813182","create date:2010/09/04 | first author:Riedl I",
"Regulation of transcription factors on sexual dimorphism of fig wasps.","/pubmed/26031454","Sun BF, Li YX, Jia LY, Niu LH, Murphy RW, Zhang P, He S, Huang DW.","Sci Rep. 2015 Jun 2;5:10696. doi: 10.1038/srep10696.","Sci Rep.  2015","PubMed","citation","PMID:26031454 | PMCID:PMC4451555","pubmed","26031454","create date:2015/06/03 | first author:Sun BF",
"A regulatory feedback loop between RpoS and SpoT supports the survival of Legionella pneumophila in water.","/pubmed/25416763","Trigui H, Dudyk P, Oh J, Hong JI, Faucher SP.","Appl Environ Microbiol. 2015 Feb;81(3):918-28. doi: 10.1128/AEM.03132-14. Epub 2014 Nov 21.","Appl Environ Microbiol.  2015","PubMed","citation","PMID:25416763 | PMCID:PMC4292471","pubmed","25416763","create date:2014/11/25 | first author:Trigui H",
"Regulatory motifs identified from a maize developmental coexpression network.","/pubmed/24884692","Downs GS, Liseron-Monfils C, Lukens LN.","Genome. 2014 Mar;57(3):181-4. doi: 10.1139/gen-2013-0177. Epub 2014 Jan 16.","Genome.  2014","PubMed","citation","PMID:24884692","pubmed","24884692","create date:2014/06/03 | first author:Downs GS",
"A Regulatory T-Cell Gene Signature Is a Specific and Sensitive Biomarker to Identify Children With New-Onset Type 1 Diabetes.","/pubmed/26786322","Pesenacker AM, Wang AY, Singh A, Gillies J, Kim Y, Piccirillo CA, Nguyen D, Haining WN, Tebbutt SJ, Panagiotopoulos C, Levings MK.","Diabetes. 2016 Apr;65(4):1031-9. doi: 10.2337/db15-0572. Epub 2016 Jan 19.","Diabetes.  2016","PubMed","citation","PMID:26786322","pubmed","26786322","create date:2016/01/21 | first author:Pesenacker AM",
"The repertoire and features of human platelet microRNAs.","/pubmed/23226537","Plé H, Landry P, Benham A, Coarfa C, Gunaratne PH, Provost P.","PLoS One. 2012;7(12):e50746. doi: 10.1371/journal.pone.0050746. Epub 2012 Dec 4.","PLoS One.  2012","PubMed","citation","PMID:23226537 | PMCID:PMC3514217","pubmed","23226537","create date:2012/12/12 | first author:Plé H",
"Repositioning FDA-Approved Drugs in Combination with Epigenetic Drugs to Reprogram Colon Cancer Epigenome.","/pubmed/27980103","Raynal NJ, Da Costa EM, Lee JT, Gharibyan V, Ahmed S, Zhang H, Sato T, Malouf GG, Issa JJ.","Mol Cancer Ther. 2017 Feb;16(2):397-407. doi: 10.1158/1535-7163.MCT-16-0588. Epub 2016 Dec 15.","Mol Cancer Ther.  2017","PubMed","citation","PMID:27980103 | PMCID:PMC5292054","pubmed","27980103","create date:2016/12/17 | first author:Raynal NJ",
"Repression of Lateral Organ Boundary Genes by PENNYWISE and POUND-FOOLISH Is Essential for Meristem Maintenance and Flowering in Arabidopsis.","/pubmed/26417006","Khan M, Ragni L, Tabb P, Salasini BC, Chatfield S, Datla R, Lock J, Kuai X, Després C, Proveniers M, Yongguo C, Xiang D, Morin H, Rullière JP, Citerne S, Hepworth SR, Pautot V.","Plant Physiol. 2015 Nov;169(3):2166-86. doi: 10.1104/pp.15.00915. Epub 2015 Sep 28.","Plant Physiol.  2015","PubMed","citation","PMID:26417006 | PMCID:PMC4634066","pubmed","26417006","create date:2015/09/30 | first author:Khan M",
"Repression of p53-target gene Bbc3/PUMA by MYSM1 is essential for the survival of hematopoietic multipotent progenitors and contributes to stem cell maintenance.","/pubmed/26768662","Belle JI, Petrov JC, Langlais D, Robert F, Cencic R, Shen S, Pelletier J, Gros P, Nijnik A.","Cell Death Differ. 2016 May;23(5):759-75. doi: 10.1038/cdd.2015.140. Epub 2016 Jan 15.","Cell Death Differ.  2016","PubMed","citation","PMID:26768662 | PMCID:PMC4832099","pubmed","26768662","create date:2016/01/16 | first author:Belle JI",
"Reproducibility, bioinformatic analysis and power of the SAGE method to evaluate changes in transcriptome.","/pubmed/15716308","Dinel S, Bolduc C, Belleau P, Boivin A, Yoshioka M, Calvo E, Piedboeuf B, Snyder EE, Labrie F, St-Amand J.","Nucleic Acids Res. 2005 Feb 16;33(3):e26.","Nucleic Acids Res.  2005","PubMed","citation","PMID:15716308 | PMCID:PMC549424","pubmed","15716308","create date:2005/02/18 | first author:Dinel S",
"Reproduction Symposium: does grazing on biosolids-treated pasture pose a pathophysiological risk associated with increased exposure to endocrine disrupting compounds?","/pubmed/24948646","Evans NP, Bellingham M, Sharpe RM, Cotinot C, Rhind SM, Kyle C, Erhard H, Hombach-Klonisch S, Lind PM, Fowler PA.","J Anim Sci. 2014 Aug;92(8):3185-98. doi: 10.2527/jas.2014-7763. Epub 2014 Jun 19. Review.","J Anim Sci.  2014","PubMed","citation","PMID:24948646","pubmed","24948646","create date:2014/06/21 | first author:Evans NP",
"Reproductive technologies and the porcine embryonic transcriptome.","/pubmed/24953007","Dyck MK, Zhou C, Tsoi S, Grant J, Dixon WT, Foxcroft GR.","Anim Reprod Sci. 2014 Sep;149(1-2):11-8. doi: 10.1016/j.anireprosci.2014.05.013. Epub 2014 Jun 6.","Anim Reprod Sci.  2014","PubMed","citation","PMID:24953007","pubmed","24953007","create date:2014/06/24 | first author:Dyck MK",
"Reprogramming of the transcriptome in a novel chromosome 3 transfer tumor suppressor ovarian cancer cell line model affected molecular networks that are characteristic of ovarian cancer.","/pubmed/19123201","Quinn MC, Filali-Mouhim A, Provencher DM, Mes-Masson AM, Tonin PN.","Mol Carcinog. 2009 Jul;48(7):648-61. doi: 10.1002/mc.20511.","Mol Carcinog.  2009","PubMed","citation","PMID:19123201","pubmed","19123201","create date:2009/01/06 | first author:Quinn MC",
"Resources for the Comprehensive Discovery of Functional RNA Elements.","/pubmed/26990993","Sundararaman B, Zhan L, Blue SM, Stanton R, Elkins K, Olson S, Wei X, Van Nostrand EL, Pratt GA, Huelga SC, Smalec BM, Wang X, Hong EL, Davidson JM, Lécuyer E, Graveley BR, Yeo GW.","Mol Cell. 2016 Mar 17;61(6):903-13. doi: 10.1016/j.molcel.2016.02.012.","Mol Cell.  2016","PubMed","citation","PMID:26990993 | PMCID:PMC4839293","pubmed","26990993","create date:2016/03/19 | first author:Sundararaman B",
"Response of the adipose tissue transcriptome to dihydrotestosterone in mice.","/pubmed/18728228","Zhang Y, Calvo E, Martel C, Luu-The V, Labrie F, Tchernof A.","Physiol Genomics. 2008 Nov 12;35(3):254-61. doi: 10.1152/physiolgenomics.00257.2007. Epub 2008 Aug 26.","Physiol Genomics.  2008","PubMed","citation","PMID:18728228","pubmed","18728228","create date:2008/08/30 | first author:Zhang Y",
"Response to angiotensin blockade with irbesartan in a patient with metastatic colorectal cancer.","/pubmed/27022066","Jones MR, Schrader KA, Shen Y, Pleasance E, Ch'ng C, Dar N, Yip S, Renouf DJ, Schein JE, Mungall AJ, Zhao Y, Moore R, Ma Y, Sheffield BS, Ng T, Jones SJ, Marra MA, Laskin J, Lim HJ.","Ann Oncol. 2016 May;27(5):801-6. doi: 10.1093/annonc/mdw060. Epub 2016 Feb 18.","Ann Oncol.  2016","PubMed","citation","PMID:27022066 | PMCID:PMC4843189","pubmed","27022066","create date:2016/03/30 | first author:Jones MR",
"Responses of bovine early embryos to S-adenosyl methionine supplementation in culture.","/pubmed/27419740","Shojaei Saadi HA, Gagné D, Fournier É, Baldoceda Baldeon LM, Sirard MA, Robert C.","Epigenomics. 2016 Aug;8(8):1039-60. doi: 10.2217/epi-2016-0022. Epub 2016 Jul 15.","Epigenomics.  2016","PubMed","citation","PMID:27419740","pubmed","27419740","create date:2016/07/16 | first author:Shojaei Saadi HA",
"Responses of the mammary transcriptome of dairy cows to altered photoperiod during late gestation.","/pubmed/26175502","Bentley PA, Wall EH, Dahl GE, McFadden TB.","Physiol Genomics. 2015 Oct;47(10):488-99. doi: 10.1152/physiolgenomics.00112.2014. Epub 2015 Jul 14.","Physiol Genomics.  2015","PubMed","citation","PMID:26175502 | PMCID:PMC4593831","pubmed","26175502","create date:2015/07/16 | first author:Bentley PA",
"Retene causes multifunctional transcriptomic changes in the heart of rainbow trout (Oncorhynchus mykiss) embryos.","/pubmed/26667672","Vehniäinen ER, Bremer K, Scott JA, Junttila S, Laiho A, Gyenesei A, Hodson PV, Oikari AO.","Environ Toxicol Pharmacol. 2016 Jan;41:95-102. doi: 10.1016/j.etap.2015.11.015. Epub 2015 Nov 28.","Environ Toxicol Pharmacol.  2016","PubMed","citation","PMID:26667672","pubmed","26667672","create date:2015/12/17 | first author:Vehniäinen ER",
"Returning to normal? Assessing transcriptome recovery over time in male rainbow darter (Etheostoma caeruleum) liver in response to wastewater-treatment plant upgrades.","/pubmed/28106290","Marjan P, Martyniuk CJ, Fuzzen MLM, MacLatchy DL, McMaster ME, Servos MR.","Environ Toxicol Chem. 2017 Aug;36(8):2108-2122. doi: 10.1002/etc.3741. Epub 2017 Feb 23.","Environ Toxicol Chem.  2017","PubMed","citation","PMID:28106290","pubmed","28106290","create date:2017/01/21 | first author:Marjan P",
"Rhodopseudomonas palustris CGA009 has two functional ppsR genes, each of which encodes a repressor of photosynthesis gene expression.","/pubmed/17128983","Braatsch S, Bernstein JR, Lessner F, Morgan J, Liao JC, Harwood CS, Beatty JT.","Biochemistry. 2006 Dec 5;45(48):14441-51.","Biochemistry.  2006","PubMed","citation","PMID:17128983","pubmed","17128983","create date:2006/11/30 | first author:Braatsch S",
"The rice R2R3-MYB transcription factor OsMYB55 is involved in the tolerance to high temperature and modulates amino acid metabolism.","/pubmed/23251677","El-Kereamy A, Bi YM, Ranathunge K, Beatty PH, Good AG, Rothstein SJ.","PLoS One. 2012;7(12):e52030. doi: 10.1371/journal.pone.0052030. Epub 2012 Dec 14.","PLoS One.  2012","PubMed","citation","PMID:23251677 | PMCID:PMC3522645","pubmed","23251677","create date:2012/12/20 | first author:El-Kereamy A",
"The RNA-binding profile of Acinus, a peripheral component of the exon junction complex, reveals its role in splicing regulation.","/pubmed/27365209","Rodor J, Pan Q, Blencowe BJ, Eyras E, Cáceres JF.","RNA. 2016 Sep;22(9):1411-26. doi: 10.1261/rna.057158.116. Epub 2016 Jun 30.","RNA.  2016","PubMed","citation","PMID:27365209 | PMCID:PMC4986896","pubmed","27365209","create date:2016/07/02 | first author:Rodor J",
