Title,URL,Description,Details,ShortDetails,Resource,Type,Identifiers,Db,EntrezUID,Properties
"Ecological genomics of host behavior manipulation by parasites.","/pubmed/24277300","Hébert FO, Aubin-Horth N.","Adv Exp Med Biol. 2014;781:169-90. doi: 10.1007/978-94-007-7347-9_9. Review.","Adv Exp Med Biol.  2014","PubMed","citation","PMID:24277300","pubmed","24277300","create date:2013/11/28 | first author:Hébert FO",
"Ectopic lymphoid structures function as microniches for tumor progenitor cells in hepatocellular carcinoma.","/pubmed/26502405","Finkin S, Yuan D, Stein I, Taniguchi K, Weber A, Unger K, Browning JL, Goossens N, Nakagawa S, Gunasekaran G, Schwartz ME, Kobayashi M, Kumada H, Berger M, Pappo O, Rajewsky K, Hoshida Y, Karin M, Heikenwalder M, Ben-Neriah Y, Pikarsky E.","Nat Immunol. 2015 Dec;16(12):1235-44. doi: 10.1038/ni.3290. Epub 2015 Oct 26.","Nat Immunol.  2015","PubMed","citation","PMID:26502405 | PMCID:PMC4653079","pubmed","26502405","create date:2015/10/27 | first author:Finkin S",
"Ectopic TLX1 expression accelerates malignancies in mice deficient in DNA-PK.","/pubmed/24586935","Krutikov K, Zheng Y, Chesney A, Huang X, Vaags AK, Evdokimova V, Hough MR, Chen E.","PLoS One. 2014 Feb 26;9(2):e89649. doi: 10.1371/journal.pone.0089649. eCollection 2014.","PLoS One.  2014","PubMed","citation","PMID:24586935 | PMCID:PMC3935916","pubmed","24586935","create date:2014/03/04 | first author:Krutikov K",
"Editor's Highlight: Hydroxyurea Exposure Activates the P53 Signaling Pathway in Murine Organogenesis-Stage Embryos.","/pubmed/27208086","El Husseini N, Schlisser AE, Hales BF.","Toxicol Sci. 2016 Aug;152(2):297-308. doi: 10.1093/toxsci/kfw089. Epub 2016 May 13.","Toxicol Sci.  2016","PubMed","citation","PMID:27208086 | PMCID:PMC4960909","pubmed","27208086","create date:2016/05/22 | first author:El Husseini N",
"Effect of a post-weaning diet supplemented with functional feed additives on ileal transcriptome activity and serum cytokines in piglets challenged with lipopolysaccharide.","/pubmed/27863544","Bissonnette N, Jiang XR, Matte JJ, Guay F, Talbot G, Bontempo V, Gong J, Wang Q, Lessard M.","Vet Immunol Immunopathol. 2016 Dec;182:136-149. doi: 10.1016/j.vetimm.2016.10.004. Epub 2016 Oct 17.","Vet Immunol Immunopathol.  2016","PubMed","citation","PMID:27863544","pubmed","27863544","create date:2016/11/20 | first author:Bissonnette N",
"Effect of active smoking on the human bronchial epithelium transcriptome.","/pubmed/17727719","Chari R, Lonergan KM, Ng RT, MacAulay C, Lam WL, Lam S.","BMC Genomics. 2007 Aug 29;8:297.","BMC Genomics.  2007","PubMed","citation","PMID:17727719 | PMCID:PMC2001199","pubmed","17727719","create date:2007/08/31 | first author:Chari R",
"The effect of energy balance on the transcriptome of bovine granulosa cells at 60 days postpartum.","/pubmed/26316219","Girard A, Dufort I, Sirard MA.","Theriogenology. 2015 Nov;84(8):1350-61.e6. doi: 10.1016/j.theriogenology.2015.07.015. Epub 2015 Jul 20.","Theriogenology.  2015","PubMed","citation","PMID:26316219","pubmed","26316219","create date:2015/09/01 | first author:Girard A",
"The effect of genotype and in utero environment on interindividual variation in neonate DNA methylomes.","/pubmed/24709820","Teh AL, Pan H, Chen L, Ong ML, Dogra S, Wong J, MacIsaac JL, Mah SM, McEwen LM, Saw SM, Godfrey KM, Chong YS, Kwek K, Kwoh CK, Soh SE, Chong MF, Barton S, Karnani N, Cheong CY, Buschdorf JP, Stünkel W, Kobor MS, et al.","Genome Res. 2014 Jul;24(7):1064-74. doi: 10.1101/gr.171439.113. Epub 2014 Apr 7.","Genome Res.  2014","PubMed","citation","PMID:24709820 | PMCID:PMC4079963","pubmed","24709820","create date:2014/04/09 | first author:Teh AL",
"The Effect of In Vitro Cultivation on the Transcriptome of Adult Brugia malayi.","/pubmed/26727204","Ballesteros C, Tritten L, O'Neill M, Burkman E, Zaky WI, Xia J, Moorhead A, Williams SA, Geary TG.","PLoS Negl Trop Dis. 2016 Jan 4;10(1):e0004311. doi: 10.1371/journal.pntd.0004311. eCollection 2016 Jan.","PLoS Negl Trop Dis.  2016","PubMed","citation","PMID:26727204 | PMCID:PMC4699822","pubmed","26727204","create date:2016/01/05 | first author:Ballesteros C",
"Effect of ovarian stimulation on oocyte gene expression in cattle.","/pubmed/22444561","Chu T, Dufort I, Sirard MA.","Theriogenology. 2012 Jun;77(9):1928-38. doi: 10.1016/j.theriogenology.2012.01.015. Epub 2012 Mar 22.","Theriogenology.  2012","PubMed","citation","PMID:22444561","pubmed","22444561","create date:2012/03/27 | first author:Chu T",
"Effect of polymorphisms within probe-target sequences on olignonucleotide microarray experiments.","/pubmed/18596082","Benovoy D, Kwan T, Majewski J.","Nucleic Acids Res. 2008 Aug;36(13):4417-23. doi: 10.1093/nar/gkn409. Epub 2008 Jul 2.","Nucleic Acids Res.  2008","PubMed","citation","PMID:18596082 | PMCID:PMC2490733","pubmed","18596082","create date:2008/07/04 | first author:Benovoy D",
"The Effect of Statins on Blood Gene Expression in COPD.","/pubmed/26462087","Obeidat M, Fishbane N, Nie Y, Chen V, Hollander Z, Tebbutt SJ, Bossé Y, Ng RT, Miller BE, McManus B, Rennard S, Paré PD, Sin DD.","PLoS One. 2015 Oct 13;10(10):e0140022. doi: 10.1371/journal.pone.0140022. eCollection 2015.","PLoS One.  2015","PubMed","citation","PMID:26462087 | PMCID:PMC4604084","pubmed","26462087","create date:2015/10/16 | first author:Obeidat M",
"Effect of transgenes on global gene expression in soybean is within the natural range of variation of conventional cultivars.","/pubmed/18433101","Cheng KC, Beaulieu J, Iquira E, Belzile FJ, Fortin MG, Strömvik MV.","J Agric Food Chem. 2008 May 14;56(9):3057-67. doi: 10.1021/jf073505i. Epub 2008 Apr 23.","J Agric Food Chem.  2008","PubMed","citation","PMID:18433101","pubmed","18433101","create date:2008/04/25 | first author:Cheng KC",
"Effect of vitrification using the Cryotop method on the gene expression profile of in vitro-produced bovine embryos.","/pubmed/26553569","de Oliveira Leme L, Dufort I, Spricigo JF, Braga TF, Sirard MA, Franco MM, Dode MA.","Theriogenology. 2016 Mar 1;85(4):724-33.e1. doi: 10.1016/j.theriogenology.2015.10.016. Epub 2015 Oct 22.","Theriogenology.  2016","PubMed","citation","PMID:26553569","pubmed","26553569","create date:2015/11/11 | first author:de Oliveira Leme L",
"The effects of 17-α-ethinylestradiol (EE2) on molecular signaling cascades in mummichog (Fundulus heteroclitus).","/pubmed/23542652","Doyle MA, Bosker T, Martyniuk CJ, Maclatchy DL, Munkittrick KR.","Aquat Toxicol. 2013 Jun 15;134-135:34-46. doi: 10.1016/j.aquatox.2013.03.001. Epub 2013 Mar 13.","Aquat Toxicol.  2013","PubMed","citation","PMID:23542652","pubmed","23542652","create date:2013/04/02 | first author:Doyle MA",
"Effects of a supplementation of n-3 polyunsaturated fatty acids with or without fish gelatin on gene expression in peripheral blood mononuclear cells in obese, insulin-resistant subjects.","/pubmed/21876360","Rudkowska I, Ponton A, Jacques H, Lavigne C, Holub BJ, Marette A, Vohl MC.","J Nutrigenet Nutrigenomics. 2011;4(4):192-202. doi: 10.1159/000330226. Epub 2011 Aug 26.","J Nutrigenet Nutrigenomics.  2011","PubMed","citation","PMID:21876360","pubmed","21876360","create date:2011/08/31 | first author:Rudkowska I",
"Effects of acute exposure to the non-steroidal anti-inflammatory drug ibuprofen on the developing North American Bullfrog (Rana catesbeiana) tadpole.","/pubmed/25111458","Veldhoen N, Skirrow RC, Brown LL, van Aggelen G, Helbing CC.","Environ Sci Technol. 2014 Sep 2;48(17):10439-47. doi: 10.1021/es502539g. Epub 2014 Aug 15.","Environ Sci Technol.  2014","PubMed","citation","PMID:25111458","pubmed","25111458","create date:2014/08/12 | first author:Veldhoen N",
"Effects of antenatal synthetic glucocorticoid on glucocorticoid receptor binding, DNA methylation, and genome-wide mRNA levels in the fetal male hippocampus.","/pubmed/24029241","Crudo A, Petropoulos S, Suderman M, Moisiadis VG, Kostaki A, Hallett M, Szyf M, Matthews SG.","Endocrinology. 2013 Nov;154(11):4170-81. doi: 10.1210/en.2013-1484. Epub 2013 Sep 12.","Endocrinology.  2013","PubMed","citation","PMID:24029241","pubmed","24029241","create date:2013/09/14 | first author:Crudo A",
"Effects of chronic metal exposure on wild fish populations revealed by high-throughput cDNA sequencing.","/pubmed/21557025","Pierron F, Normandeau E, Defo MA, Campbell PG, Bernatchez L, Couture P.","Ecotoxicology. 2011 Aug;20(6):1388-99. doi: 10.1007/s10646-011-0696-z. Epub 2011 May 10.","Ecotoxicology.  2011","PubMed","citation","PMID:21557025","pubmed","21557025","create date:2011/05/11 | first author:Pierron F",
"Effects of cold-acclimation on gene expression in Fall field cricket (Gryllus pennsylvanicus) ionoregulatory tissues.","/pubmed/28482796","Des Marteaux LE, McKinnon AH, Udaka H, Toxopeus J, Sinclair BJ.","BMC Genomics. 2017 May 8;18(1):357. doi: 10.1186/s12864-017-3711-9.","BMC Genomics.  2017","PubMed","citation","PMID:28482796 | PMCID:PMC5422886","pubmed","28482796","create date:2017/05/10 | first author:Des Marteaux LE",
"Effects of dietary physical or nutritional factors on morphology of rumen papillae and transcriptome changes in lactating dairy cows based on three different forage-based diets.","/pubmed/28477620","Wang B, Wang D, Wu X, Cai J, Liu M, Huang X, Wu J, Liu J, Guan L.","BMC Genomics. 2017 May 6;18(1):353. doi: 10.1186/s12864-017-3726-2.","BMC Genomics.  2017","PubMed","citation","PMID:28477620 | PMCID:PMC5420399","pubmed","28477620","create date:2017/05/10 | first author:Wang B",
"Effects of dihydrotestosterone on gene expression in mammary gland.","/pubmed/18602997","Aboghe DH, Bolduc C, Yoshioka M, St-Amand J.","J Steroid Biochem Mol Biol. 2008 Sep;111(3-5):225-31. doi: 10.1016/j.jsbmb.2008.06.006. Epub 2008 Jun 18.","J Steroid Biochem Mol Biol.  2008","PubMed","citation","PMID:18602997","pubmed","18602997","create date:2008/07/08 | first author:Aboghe DH",
"Effects of dihydrotestosterone on skeletal muscle transcriptome in mice measured by serial analysis of gene expression.","/pubmed/16595697","Yoshioka M, Boivin A, Ye P, Labrie F, St-Amand J.","J Mol Endocrinol. 2006 Apr;36(2):247-59.","J Mol Endocrinol.  2006","PubMed","citation","PMID:16595697","pubmed","16595697","create date:2006/04/06 | first author:Yoshioka M",
"Effects of domestication and growth hormone transgenesis on mRNA profiles in rainbow trout (Oncorhynchus mykiss).","/pubmed/24045478","Devlin RH, Sakhrani D, White S, Overturf K.","J Anim Sci. 2013 Nov;91(11):5247-58. doi: 10.2527/jas.2013-6612. Epub 2013 Sep 17.","J Anim Sci.  2013","PubMed","citation","PMID:24045478","pubmed","24045478","create date:2013/09/21 | first author:Devlin RH",
"Effects of eIFiso4G1 mutation on seed oil biosynthesis.","/pubmed/28244172","Li Q, Shen W, Zheng Q, Tan Y, Gao J, Shen J, Wei Y, Kunst L, Zou J.","Plant J. 2017 Jun;90(5):966-978. doi: 10.1111/tpj.13522. Epub 2017 Apr 29.","Plant J.  2017","PubMed","citation","PMID:28244172","pubmed","28244172","create date:2017/03/01 | first author:Li Q",
"Effects of exposure to 17α-ethynylestradiol during sexual differentiation on the transcriptome of the African clawed frog (Xenopus laevis).","/pubmed/23550701","Tompsett AR, Wiseman S, Higley E, Giesy JP, Hecker M.","Environ Sci Technol. 2013 May 7;47(9):4822-8. doi: 10.1021/es400436y. Epub 2013 Apr 25.","Environ Sci Technol.  2013","PubMed","citation","PMID:23550701","pubmed","23550701","create date:2013/04/05 | first author:Tompsett AR",
"Effects of food-borne exposure of juvenile rainbow trout (Oncorhynchus mykiss) to emerging brominated flame retardants 1,2-bis(2,4,6-tribromophenoxy)ethane and 2-ethylhexyl-2,3,4,5-tetrabromobenzoate.","/pubmed/28249227","Giraudo M, Douville M, Letcher RJ, Houde M.","Aquat Toxicol. 2017 May;186:40-49. doi: 10.1016/j.aquatox.2017.02.023. Epub 2017 Feb 22.","Aquat Toxicol.  2017","PubMed","citation","PMID:28249227","pubmed","28249227","create date:2017/03/02 | first author:Giraudo M",
"The effects of glial cell line-derived neurotrophic factor on the in vitro matured porcine oocyte transcriptome.","/pubmed/24293385","Toms D, Tsoi S, Dobrinsky J, Dyck MK, Li J.","Mol Reprod Dev. 2014 Mar;81(3):217-29. doi: 10.1002/mrd.22288. Epub 2014 Jan 10.","Mol Reprod Dev.  2014","PubMed","citation","PMID:24293385","pubmed","24293385","create date:2013/12/03 | first author:Toms D",
"Effects of introgression on the genetic population structure of two ecologically and economically important conifer species: lodgepole pine (Pinus contorta var. latifolia) and jack pine (Pinus banksiana).","/pubmed/24237338","Cullingham CI, Cooke JE, Coltman DW.","Genome. 2013 Oct;56(10):577-85. doi: 10.1139/gen-2013-0071. Epub 2013 Jun 10.","Genome.  2013","PubMed","citation","PMID:24237338","pubmed","24237338","create date:2013/11/19 | first author:Cullingham CI",
"Effects of Perfluorooctanoic Acid on Metabolic Profiles in Brain and Liver of Mouse Revealed by a High-throughput Targeted Metabolomics Approach.","/pubmed/27032815","Yu N, Wei S, Li M, Yang J, Li K, Jin L, Xie Y, Giesy JP, Zhang X, Yu H.","Sci Rep. 2016 Apr 1;6:23963. doi: 10.1038/srep23963.","Sci Rep.  2016","PubMed","citation","PMID:27032815 | PMCID:PMC4817033","pubmed","27032815","create date:2016/04/02 | first author:Yu N",
"Effects of sample size on differential gene expression, rank order and prediction accuracy of a gene signature.","/pubmed/23755224","Stretch C, Khan S, Asgarian N, Eisner R, Vaisipour S, Damaraju S, Graham K, Bathe OF, Steed H, Greiner R, Baracos VE.","PLoS One. 2013 Jun 3;8(6):e65380. doi: 10.1371/journal.pone.0065380. Print 2013.","PLoS One.  2013","PubMed","citation","PMID:23755224 | PMCID:PMC3670871","pubmed","23755224","create date:2013/06/12 | first author:Stretch C",
"Effects of Tris(1,3-dichloro-2-propyl) Phosphate (TDCPP) in Tetrahymena Thermophila: Targeting the Ribosome.","/pubmed/25994279","Li J, Giesy JP, Yu L, Li G, Liu C.","Sci Rep. 2015 May 21;5:10562. doi: 10.1038/srep10562.","Sci Rep.  2015","PubMed","citation","PMID:25994279 | PMCID:PMC4440212","pubmed","25994279","create date:2015/05/23 | first author:Li J",
"Efficacy of UV-C photolysis of bisphenol A on transcriptome alterations of genes in zebrafish embryos.","/pubmed/27314163","Saeed A, Hashmi I, Zare A, Mehrabani-Zeinabad M, Achari G, Habibi HR.","J Environ Sci Health A Tox Hazard Subst Environ Eng. 2016 Sep 18;51(11):877-83. doi: 10.1080/10934529.2016.1191296. Epub 2016 Jun 17.","J Environ Sci Health A Tox Hazard Subst Environ Eng.  2016","PubMed","citation","PMID:27314163","pubmed","27314163","create date:2016/06/18 | first author:Saeed A",
"EGFR Mutation Promotes Glioblastoma through Epigenome and Transcription Factor Network Remodeling.","/pubmed/26455392","Liu F, Hon GC, Villa GR, Turner KM, Ikegami S, Yang H, Ye Z, Li B, Kuan S, Lee AY, Zanca C, Wei B, Lucey G, Jenkins D, Zhang W, Barr CL, Furnari FB, Cloughesy TF, Yong WH, Gahman TC, Shiau AK, Cavenee WK, et al.","Mol Cell. 2015 Oct 15;60(2):307-18. doi: 10.1016/j.molcel.2015.09.002. Epub 2015 Oct 8.","Mol Cell.  2015","PubMed","citation","PMID:26455392 | PMCID:PMC4609298","pubmed","26455392","create date:2015/10/13 | first author:Liu F",
"Egg ovotransferrin-derived ACE inhibitory peptide IRW increases ACE2 but decreases proinflammatory genes expression in mesenteric artery of spontaneously hypertensive rats.","/pubmed/26016560","Majumder K, Liang G, Chen Y, Guan L, Davidge ST, Wu J.","Mol Nutr Food Res. 2015 Sep;59(9):1735-44. doi: 10.1002/mnfr.201500050. Epub 2015 Jun 26.","Mol Nutr Food Res.  2015","PubMed","citation","PMID:26016560 | PMCID:PMC5034750","pubmed","26016560","create date:2015/05/29 | first author:Majumder K",
"Elements of a 'nervous system' in sponges.","/pubmed/25696821","Leys SP.","J Exp Biol. 2015 Feb 15;218(Pt 4):581-91. doi: 10.1242/jeb.110817. Review.","J Exp Biol.  2015","PubMed","citation","PMID:25696821","pubmed","25696821","create date:2015/02/20 | first author:Leys SP",
"Elf5-centered transcription factor hub controls trophoblast stem cell self-renewal and differentiation through stoichiometry-sensitive shifts in target gene networks.","/pubmed/26584622","Latos PA, Sienerth AR, Murray A, Senner CE, Muto M, Ikawa M, Oxley D, Burge S, Cox BJ, Hemberger M.","Genes Dev. 2015 Dec 1;29(23):2435-48. doi: 10.1101/gad.268821.115. Epub 2015 Nov 19.","Genes Dev.  2015","PubMed","citation","PMID:26584622 | PMCID:PMC4691948","pubmed","26584622","create date:2015/11/21 | first author:Latos PA",
"Elucidating steroid alkaloid biosynthesis in Veratrum californicum: production of verazine in Sf9 cells.","/pubmed/25939370","Augustin MM, Ruzicka DR, Shukla AK, Augustin JM, Starks CM, O'Neil-Johnson M, McKain MR, Evans BS, Barrett MD, Smithson A, Wong GK, Deyholos MK, Edger PP, Pires JC, Leebens-Mack JH, Mann DA, Kutchan TM.","Plant J. 2015 Jun;82(6):991-1003. doi: 10.1111/tpj.12871.","Plant J.  2015","PubMed","citation","PMID:25939370 | PMCID:PMC4464957","pubmed","25939370","create date:2015/05/06 | first author:Augustin MM",
"Elucidating the germination transcriptional program using small molecules.","/pubmed/18359847","Bassel GW, Fung P, Chow TF, Foong JA, Provart NJ, Cutler SR.","Plant Physiol. 2008 May;147(1):143-55. doi: 10.1104/pp.107.110841. Epub 2008 Mar 21.","Plant Physiol.  2008","PubMed","citation","PMID:18359847 | PMCID:PMC2330302","pubmed","18359847","create date:2008/03/25 | first author:Bassel GW",
"The elucidation of stress memory inheritance in Brassica rapa plants.","/pubmed/25653665","Bilichak A, Ilnytskyy Y, Wóycicki R, Kepeshchuk N, Fogen D, Kovalchuk I.","Front Plant Sci. 2015 Jan 21;6:5. doi: 10.3389/fpls.2015.00005. eCollection 2015.","Front Plant Sci.  2015","PubMed","citation","PMID:25653665 | PMCID:PMC4300914","pubmed","25653665","create date:2015/02/06 | first author:Bilichak A",
"An empirical strategy to detect bacterial transcript structure from directional RNA-seq transcriptome data.","/pubmed/25947005","Wang Y, MacKenzie KD, White AP.","BMC Genomics. 2015 May 7;16:359. doi: 10.1186/s12864-015-1555-8.","BMC Genomics.  2015","PubMed","citation","PMID:25947005 | PMCID:PMC4422608","pubmed","25947005","create date:2015/05/08 | first author:Wang Y",
"Enabling comparative gene expression studies of thyroid hormone action through the development of a flexible real-time quantitative PCR assay for use across multiple anuran indicator and sentinel species.","/pubmed/24503578","Veldhoen N, Propper CR, Helbing CC.","Aquat Toxicol. 2014 Mar;148:162-73. doi: 10.1016/j.aquatox.2014.01.008. Epub 2014 Jan 22.","Aquat Toxicol.  2014","PubMed","citation","PMID:24503578","pubmed","24503578","create date:2014/02/08 | first author:Veldhoen N",
"Endogenous hydrogen sulfide production is essential for dietary restriction benefits.","/pubmed/25542313","Hine C, Harputlugil E, Zhang Y, Ruckenstuhl C, Lee BC, Brace L, Longchamp A, Treviño-Villarreal JH, Mejia P, Ozaki CK, Wang R, Gladyshev VN, Madeo F, Mair WB, Mitchell JR.","Cell. 2015 Jan 15;160(1-2):132-44. doi: 10.1016/j.cell.2014.11.048. Epub 2014 Dec 23.","Cell.  2015","PubMed","citation","PMID:25542313 | PMCID:PMC4297538","pubmed","25542313","create date:2014/12/30 | first author:Hine C",
"Endogenous overexpression of Populus MYB186 increases trichome density, improves insect pest resistance, and impacts plant growth.","/pubmed/20807210","Plett JM, Wilkins O, Campbell MM, Ralph SG, Regan S.","Plant J. 2010 Nov;64(3):419-32. doi: 10.1111/j.1365-313X.2010.04343.x.","Plant J.  2010","PubMed","citation","PMID:20807210","pubmed","20807210","create date:2010/09/03 | first author:Plett JM",
Title,URL,Description,Details,ShortDetails,Resource,Type,Identifiers,Db,EntrezUID,Properties
"Endosymbiotic gene transfer in tertiary plastid-containing dinoflagellates.","/pubmed/24297445","Burki F, Imanian B, Hehenberger E, Hirakawa Y, Maruyama S, Keeling PJ.","Eukaryot Cell. 2014 Feb;13(2):246-55. doi: 10.1128/EC.00299-13. Epub 2013 Dec 2.","Eukaryot Cell.  2014","PubMed","citation","PMID:24297445 | PMCID:PMC3910982","pubmed","24297445","create date:2013/12/04 | first author:Burki F",
"Engagement of the Aryl Hydrocarbon Receptor in Mycobacterium tuberculosis-Infected Macrophages Has Pleiotropic Effects on Innate Immune Signaling.","/pubmed/26416282","Memari B, Bouttier M, Dimitrov V, Ouellette M, Behr MA, Fritz JH, White JH.","J Immunol. 2015 Nov 1;195(9):4479-91. doi: 10.4049/jimmunol.1501141. Epub 2015 Sep 28.","J Immunol.  2015","PubMed","citation","PMID:26416282","pubmed","26416282","create date:2015/09/30 | first author:Memari B",
"Enhanced degradation of softwood versus hardwood by the white-rot fungus Pycnoporus coccineus.","/pubmed/26692083","Couturier M, Navarro D, Chevret D, Henrissat B, Piumi F, Ruiz-Dueñas FJ, Martinez AT, Grigoriev IV, Riley R, Lipzen A, Berrin JG, Master ER, Rosso MN.","Biotechnol Biofuels. 2015 Dec 18;8:216. doi: 10.1186/s13068-015-0407-8. eCollection 2015.","Biotechnol Biofuels.  2015","PubMed","citation","PMID:26692083 | PMCID:PMC4683735","pubmed","26692083","create date:2015/12/23 | first author:Couturier M",
"Enhanced Inflammatory Transcriptome in the Granulosa Cells of Women With Polycystic Ovarian Syndrome.","/pubmed/27228368","Adams J, Liu Z, Ren YA, Wun WS, Zhou W, Kenigsberg S, Librach C, Valdes C, Gibbons W, Richards J.","J Clin Endocrinol Metab. 2016 Sep;101(9):3459-68. doi: 10.1210/jc.2015-4275. Epub 2016 May 26.","J Clin Endocrinol Metab.  2016","PubMed","citation","PMID:27228368 | PMCID:PMC5010574","pubmed","27228368","create date:2016/05/27 | first author:Adams J",
"Enhanced transcriptome maps from multiple mouse tissues reveal evolutionary constraint in gene expression.","/pubmed/25582907","Pervouchine DD, Djebali S, Breschi A, Davis CA, Barja PP, Dobin A, Tanzer A, Lagarde J, Zaleski C, See LH, Fastuca M, Drenkow J, Wang H, Bussotti G, Pei B, Balasubramanian S, Monlong J, Harmanci A, Gerstein M, Beer MA, Notredame C, Guigó R, et al.","Nat Commun. 2015 Jan 13;6:5903. doi: 10.1038/ncomms6903.","Nat Commun.  2015","PubMed","citation","PMID:25582907 | PMCID:PMC4308717","pubmed","25582907","create date:2015/01/15 | first author:Pervouchine DD",
"Enhanced whole genome sequence and annotation of Clostridium stercorarium DSM8532T using RNA-seq transcriptomics and high-throughput proteomics.","/pubmed/24998381","Schellenberg JJ, Verbeke TJ, McQueen P, Krokhin OV, Zhang X, Alvare G, Fristensky B, Thallinger GG, Henrissat B, Wilkins JA, Levin DB, Sparling R.","BMC Genomics. 2014 Jul 7;15:567. doi: 10.1186/1471-2164-15-567.","BMC Genomics.  2014","PubMed","citation","PMID:24998381 | PMCID:PMC4102724","pubmed","24998381","create date:2014/07/08 | first author:Schellenberg JJ",
"Environmental Breviatea harbour mutualistic Arcobacter epibionts.","/pubmed/27279223","Hamann E, Gruber-Vodicka H, Kleiner M, Tegetmeyer HE, Riedel D, Littmann S, Chen J, Milucka J, Viehweger B, Becker KW, Dong X, Stairs CW, Hinrichs KU, Brown MW, Roger AJ, Strous M.","Nature. 2016 Jun 9;534(7606):254-8. doi: 10.1038/nature18297. Epub 2016 Jun 1.","Nature.  2016","PubMed","citation","PMID:27279223 | PMCID:PMC4900452","pubmed","27279223","create date:2016/06/10 | first author:Hamann E",
"Epigenetic assimilation in the aging human brain.","/pubmed/27122015","Oh G, Ebrahimi S, Wang SC, Cortese R, Kaminsky ZA, Gottesman II, Burke JR, Plassman BL, Petronis A.","Genome Biol. 2016 Apr 28;17:76. doi: 10.1186/s13059-016-0946-8.","Genome Biol.  2016","PubMed","citation","PMID:27122015 | PMCID:PMC4848814","pubmed","27122015","create date:2016/04/29 | first author:Oh G",
"Epigenetic modification with trichostatin A does not correct specific errors of somatic cell nuclear transfer at the transcriptomic level; highlighting the non-random nature of oocyte-mediated reprogramming errors.","/pubmed/26725231","Hosseini SM, Dufort I, Nieminen J, Moulavi F, Ghanaei HR, Hajian M, Jafarpour F, Forouzanfar M, Gourbai H, Shahverdi AH, Nasr-Esfahani MH, Sirard MA.","BMC Genomics. 2016 Jan 4;17:16. doi: 10.1186/s12864-015-2264-z.","BMC Genomics.  2016","PubMed","citation","PMID:26725231 | PMCID:PMC4698792","pubmed","26725231","create date:2016/01/05 | first author:Hosseini SM",
"Epigenetic regulation of the neural transcriptome: the meaning of the marks.","/pubmed/20975754","Meaney MJ, Ferguson-Smith AC.","Nat Neurosci. 2010 Nov;13(11):1313-8. doi: 10.1038/nn1110-1313.","Nat Neurosci.  2010","PubMed","citation","PMID:20975754","pubmed","20975754","create date:2010/10/27 | first author:Meaney MJ",
"Epistatic interaction between the lipase-encoding genes Pnpla2 and Lipe causes liposarcoma in mice.","/pubmed/28459858","Wu JW, Preuss C, Wang SP, Yang H, Ji B, Carter GW, Gladdy R, Andelfinger G, Mitchell GA.","PLoS Genet. 2017 May 1;13(5):e1006716. doi: 10.1371/journal.pgen.1006716. eCollection 2017 May.","PLoS Genet.  2017","PubMed","citation","PMID:28459858 | PMCID:PMC5432192","pubmed","28459858","create date:2017/05/02 | first author:Wu JW",
"ePlant: Visualizing and Exploring Multiple Levels of Data for Hypothesis Generation in Plant Biology.","/pubmed/28808136","Waese J, Fan J, Pasha A, Yu H, Fucile G, Shi R, Cumming M, Kelley L, Sternberg M, Krishnakumar V, Ferlanti E, Miller J, Town C, Stuerzlinger W, Provart NJ.","Plant Cell. 2017 Aug 14. pii: tpc.00073.2017. doi: 10.1105/tpc.17.00073. [Epub ahead of print]","Plant Cell.  2017","PubMed","citation","PMID:28808136","pubmed","28808136","create date:2017/08/16 | first author:Waese J",
"Erratum to: Transcriptome responses to temperature, water availability and photoperiod are conserved among mature trees of two divergent Douglas-fir provenances from a coastal and an interior habitat.","/pubmed/27716042","Hess M, Wildhagen H, Junker LV, Ensminger I.","BMC Genomics. 2016 Oct 6;17(1):780. No abstract available. ","BMC Genomics.  2016","PubMed","citation","PMID:27716042 | PMCID:PMC5053107","pubmed","27716042","create date:2016/10/08 | first author:Hess M",
