Title,URL,Description,Details,ShortDetails,Resource,Type,Identifiers,Db,EntrezUID,Properties
"Quantifying condition-dependent intracellular protein levels enables high-precision fitness estimates.","/pubmed/24086506","Geiler-Samerotte KA, Hashimoto T, Dion MF, Budnik BA, Airoldi EM, Drummond DA.","PLoS One. 2013 Sep 25;8(9):e75320. doi: 10.1371/journal.pone.0075320. eCollection 2013. Erratum in: PLoS One. 2013;8(10). doi:10.1371/annotation/9f5465d9-e9fa-4a80-84ca-9c9a3f6e82c7. ","PLoS One.  2013","PubMed","citation","PMID:24086506 | PMCID:PMC3783400","pubmed","24086506","create date:2013/10/03 | first author:Geiler-Samerotte KA",
"From genes to milk: genomic organization and epigenetic regulation of the mammary transcriptome.","/pubmed/24086428","Lemay DG, Pollard KS, Martin WF, Freeman Zadrowski C, Hernandez J, Korf I, German JB, Rijnkels M.","PLoS One. 2013 Sep 26;8(9):e75030. doi: 10.1371/journal.pone.0075030. eCollection 2013.","PLoS One.  2013","PubMed","citation","PMID:24086428 | PMCID:PMC3784412","pubmed","24086428","create date:2013/10/03 | first author:Lemay DG",
"Gene regulatory networks elucidating huanglongbing disease mechanisms.","/pubmed/24086326","Martinelli F, Reagan RL, Uratsu SL, Phu ML, Albrecht U, Zhao W, Davis CE, Bowman KD, Dandekar AM.","PLoS One. 2013 Sep 25;8(9):e74256. doi: 10.1371/journal.pone.0074256. eCollection 2013.","PLoS One.  2013","PubMed","citation","PMID:24086326 | PMCID:PMC3783430","pubmed","24086326","create date:2013/10/03 | first author:Martinelli F",
"Transcriptome analysis of human peripheral blood mononuclear cells exposed to Lassa virus and to the attenuated Mopeia/Lassa reassortant 29 (ML29), a vaccine candidate.","/pubmed/24069471","Zapata JC, Carrion R Jr, Patterson JL, Crasta O, Zhang Y, Mani S, Jett M, Poonia B, Djavani M, White DM, Lukashevich IS, Salvato MS.","PLoS Negl Trop Dis. 2013 Sep 12;7(9):e2406. doi: 10.1371/journal.pntd.0002406. eCollection 2013.","PLoS Negl Trop Dis.  2013","PubMed","citation","PMID:24069471 | PMCID:PMC3772037","pubmed","24069471","create date:2013/09/27 | first author:Zapata JC",
"Interferon signature in the blood in inflammatory common variable immune deficiency.","/pubmed/24069364","Park J, Munagala I, Xu H, Blankenship D, Maffucci P, Chaussabel D, Banchereau J, Pascual V, Cunningham-Rundles C.","PLoS One. 2013 Sep 17;8(9):e74893. doi: 10.1371/journal.pone.0074893. eCollection 2013.","PLoS One.  2013","PubMed","citation","PMID:24069364 | PMCID:PMC3775732","pubmed","24069364","create date:2013/09/27 | first author:Park J",
"A degenerative retinal process in HIV-associated non-infectious retinopathy.","/pubmed/24069333","Kozak I, Sasik R, Freeman WR, Sprague LJ, Gomez ML, Cheng L, El-Emam S, Mojana F, Bartsch DU, Bosten J, Ayyagari R, Hardiman G.","PLoS One. 2013 Sep 17;8(9):e74712. doi: 10.1371/journal.pone.0074712. eCollection 2013.","PLoS One.  2013","PubMed","citation","PMID:24069333 | PMCID:PMC3775801","pubmed","24069333","create date:2013/09/27 | first author:Kozak I",
"Transcriptome sequences resolve deep relationships of the grape family.","/pubmed/24069307","Wen J, Xiong Z, Nie ZL, Mao L, Zhu Y, Kan XZ, Ickert-Bond SM, Gerrath J, Zimmer EA, Fang XD.","PLoS One. 2013 Sep 17;8(9):e74394. doi: 10.1371/journal.pone.0074394. eCollection 2013.","PLoS One.  2013","PubMed","citation","PMID:24069307 | PMCID:PMC3775763","pubmed","24069307","create date:2013/09/27 | first author:Wen J",
"Development of genomic resources for a thraustochytrid pathogen and investigation of temperature influences on gene expression.","/pubmed/24069279","Garcia-Vedrenne AE, Groner M, Page-Karjian A, Siegmund GF, Singhal S, Sziklay J, Roberts S.","PLoS One. 2013 Sep 17;8(9):e74196. doi: 10.1371/journal.pone.0074196. eCollection 2013.","PLoS One.  2013","PubMed","citation","PMID:24069279 | PMCID:PMC3775781","pubmed","24069279","create date:2013/09/27 | first author:Garcia-Vedrenne AE",
"Enhancement of osteogenic differentiation and proliferation in human mesenchymal stem cells by a modified low intensity ultrasound stimulation under simulated microgravity.","/pubmed/24069248","Uddin SM, Qin YX.","PLoS One. 2013 Sep 12;8(9):e73914. doi: 10.1371/journal.pone.0073914. eCollection 2013.","PLoS One.  2013","PubMed","citation","PMID:24069248 | PMCID:PMC3772078","pubmed","24069248","create date:2013/09/27 | first author:Uddin SM",
"Estradiol and progesterone exhibit similar patterns of hepatic gene expression regulation in the bovine model.","/pubmed/24069207","Piccinato CA, Rosa GJ, N'jai AU, Jefcoate CR, Wiltbank MC.","PLoS One. 2013 Sep 17;8(9):e73552. doi: 10.1371/journal.pone.0073552. eCollection 2013.","PLoS One.  2013","PubMed","citation","PMID:24069207 | PMCID:PMC3775788","pubmed","24069207","create date:2013/09/27 | first author:Piccinato CA",
"Tomato spotted wilt virus benefits a non-vector arthropod, Tetranychus urticae, by modulating different plant responses in tomato.","/pubmed/24058708","Nachappa P, Margolies DC, Nechols JR, Whitfield AE, Rotenberg D.","PLoS One. 2013 Sep 18;8(9):e75909. doi: 10.1371/journal.pone.0075909. eCollection 2013.","PLoS One.  2013","PubMed","citation","PMID:24058708 | PMCID:PMC3776767","pubmed","24058708","create date:2013/09/24 | first author:Nachappa P",
"Analysis of the host transcriptome from demyelinating spinal cord of murine coronavirus-infected mice.","/pubmed/24058676","Elliott R, Li F, Dragomir I, Chua MM, Gregory BD, Weiss SR.","PLoS One. 2013 Sep 18;8(9):e75346. doi: 10.1371/journal.pone.0075346. eCollection 2013.","PLoS One.  2013","PubMed","citation","PMID:24058676 | PMCID:PMC3776850","pubmed","24058676","create date:2013/09/24 | first author:Elliott R",
"Bile salts affect expression of Escherichia coli O157:H7 genes for virulence and iron acquisition, and promote growth under iron limiting conditions.","/pubmed/24058617","Hamner S, McInnerney K, Williamson K, Franklin MJ, Ford TE.","PLoS One. 2013 Sep 10;8(9):e74647. doi: 10.1371/journal.pone.0074647. eCollection 2013.","PLoS One.  2013","PubMed","citation","PMID:24058617 | PMCID:PMC3769235","pubmed","24058617","create date:2013/09/24 | first author:Hamner S",
"Superior cross-species reference genes: a blueberry case study.","/pubmed/24058469","Die JV, Rowland LJ.","PLoS One. 2013 Sep 18;8(9):e73354. doi: 10.1371/journal.pone.0073354. eCollection 2013.","PLoS One.  2013","PubMed","citation","PMID:24058469 | PMCID:PMC3776805","pubmed","24058469","create date:2013/09/24 | first author:Die JV",
"Ultrasonic incisions produce less inflammatory mediator response during early healing than electrosurgical incisions.","/pubmed/24058457","Nanduri B, Pendarvis K, Shack LA, Kumar R, Clymer JW, Korvick DL, Burgess SC.","PLoS One. 2013 Sep 18;8(9):e73032. doi: 10.1371/journal.pone.0073032. eCollection 2013.","PLoS One.  2013","PubMed","citation","PMID:24058457 | PMCID:PMC3776814","pubmed","24058457","create date:2013/09/24 | first author:Nanduri B",
"Human cell toxicogenomic analysis linking reactive oxygen species to the toxicity of monohaloacetic acid drinking water disinfection byproducts.","/pubmed/24050308","Pals J, Attene-Ramos MS, Xia M, Wagner ED, Plewa MJ.","Environ Sci Technol. 2013;47(21):12514-23. doi: 10.1021/es403171b. Epub 2013 Oct 10.","Environ Sci Technol.  2013","PubMed","citation","PMID:24050308 | PMCID:PMC4014314","pubmed","24050308","create date:2013/09/21 | first author:Pals J",
"Systems-based identification of temporal processing pathways during bone cell mechanotransduction.","/pubmed/24040202","Worton LE, Ausk BJ, Downey LM, Bain SD, Gardiner EM, Srinivasan S, Gross TS, Kwon RY.","PLoS One. 2013 Sep 11;8(9):e74205. doi: 10.1371/journal.pone.0074205. eCollection 2013.","PLoS One.  2013","PubMed","citation","PMID:24040202 | PMCID:PMC3770665","pubmed","24040202","create date:2013/09/17 | first author:Worton LE",
"Cell-specific post-transcriptional regulation of γ-synuclein gene by micro-RNAs.","/pubmed/24040069","Surgucheva I, Gunewardena S, Rao HS, Surguchov A.","PLoS One. 2013 Sep 11;8(9):e73786. doi: 10.1371/journal.pone.0073786. eCollection 2013.","PLoS One.  2013","PubMed","citation","PMID:24040069 | PMCID:PMC3770685","pubmed","24040069","create date:2013/09/17 | first author:Surgucheva I",
"Beta cell 5'-shifted isomiRs are candidate regulatory hubs in type 2 diabetes.","/pubmed/24039891","Baran-Gale J, Fannin EE, Kurtz CL, Sethupathy P.","PLoS One. 2013 Sep 9;8(9):e73240. doi: 10.1371/journal.pone.0073240. eCollection 2013.","PLoS One.  2013","PubMed","citation","PMID:24039891 | PMCID:PMC3767796","pubmed","24039891","create date:2013/09/17 | first author:Baran-Gale J",
"Epimorphin-induced MET sensitizes ovarian cancer cells to platinum.","/pubmed/24039787","Yew KH, Crow J, Hirst J, Pessetto Z, Godwin AK.","PLoS One. 2013 Sep 9;8(9):e72637. doi: 10.1371/journal.pone.0072637. eCollection 2013. Erratum in: PLoS One. 2013;8(10). doi:10.1371/annotation/9c557fb1-7997-4c21-bd11-03bf5c3d4418. Pressetto, Ziyan [corrected to Pessetto, Ziyan]. ","PLoS One.  2013","PubMed","citation","PMID:24039787 | PMCID:PMC3767807","pubmed","24039787","create date:2013/09/17 | first author:Yew KH",
"Transcriptome resources for the frogs Lithobates clamitans and Pseudacris regilla, emphasizing antimicrobial peptides and conserved loci for phylogenetics.","/pubmed/24028389","Robertson LS, Cornman RS.","Mol Ecol Resour. 2014 Jan;14(1):178-83. doi: 10.1111/1755-0998.12164. Epub 2013 Sep 13.","Mol Ecol Resour.  2014","PubMed","citation","PMID:24028389","pubmed","24028389","create date:2013/09/14 | first author:Robertson LS",
"Analysis of Phakopsora pachyrhizi transcript abundance in critical pathways at four time-points during infection of a susceptible soybean cultivar using deep sequencing.","/pubmed/24025037","Tremblay A, Hosseini P, Li S, Alkharouf NW, Matthews BF.","BMC Genomics. 2013 Sep 11;14:614. doi: 10.1186/1471-2164-14-614.","BMC Genomics.  2013","PubMed","citation","PMID:24025037 | PMCID:PMC3847679","pubmed","24025037","create date:2013/09/13 | first author:Tremblay A",
"Whole transcriptome sequencing enables discovery and analysis of viruses in archived primary central nervous system lymphomas.","/pubmed/24023918","DeBoever C, Reid EG, Smith EN, Wang X, Dumaop W, Harismendy O, Carson D, Richman D, Masliah E, Frazer KA.","PLoS One. 2013 Sep 4;8(9):e73956. doi: 10.1371/journal.pone.0073956. eCollection 2013.","PLoS One.  2013","PubMed","citation","PMID:24023918 | PMCID:PMC3762708","pubmed","24023918","create date:2013/09/12 | first author:DeBoever C",
"Characterisation of the transcriptomes of genetically diverse Listeria monocytogenes exposed to hyperosmotic and low temperature conditions reveal global stress-adaptation mechanisms.","/pubmed/24023890","Durack J, Ross T, Bowman JP.","PLoS One. 2013 Sep 4;8(9):e73603. doi: 10.1371/journal.pone.0073603. eCollection 2013.","PLoS One.  2013","PubMed","citation","PMID:24023890 | PMCID:PMC3762727","pubmed","24023890","create date:2013/09/12 | first author:Durack J",
"In-depth characterization of microRNA transcriptome in melanoma.","/pubmed/24023765","Kozubek J, Ma Z, Fleming E, Duggan T, Wu R, Shin DG, Dadras SS.","PLoS One. 2013 Sep 4;8(9):e72699. doi: 10.1371/journal.pone.0072699. eCollection 2013.","PLoS One.  2013","PubMed","citation","PMID:24023765 | PMCID:PMC3762816","pubmed","24023765","create date:2013/09/12 | first author:Kozubek J",
"Secondary structure of a conserved domain in the intron of influenza A NS1 mRNA.","/pubmed/24023714","Priore SF, Kierzek E, Kierzek R, Baman JR, Moss WN, Dela-Moss LI, Turner DH.","PLoS One. 2013 Sep 2;8(9):e70615. doi: 10.1371/journal.pone.0070615. eCollection 2013.","PLoS One.  2013","PubMed","citation","PMID:24023714 | PMCID:PMC3759394","pubmed","24023714","create date:2013/09/12 | first author:Priore SF",
"Signatures of rapid evolution in urban and rural transcriptomes of white-footed mice (Peromyscus leucopus) in the New York metropolitan area.","/pubmed/24015321","Harris SE, Munshi-South J, Obergfell C, O'Neill R.","PLoS One. 2013 Aug 28;8(8):e74938. doi: 10.1371/journal.pone.0074938. eCollection 2013.","PLoS One.  2013","PubMed","citation","PMID:24015321 | PMCID:PMC3756007","pubmed","24015321","create date:2013/09/10 | first author:Harris SE",
"Genetic background may contribute to PAM50 gene expression breast cancer subtype assignments.","/pubmed/24015230","Hu Y, Bai L, Geiger T, Goldberger N, Walker RC, Green JE, Wakefield LM, Hunter KW.","PLoS One. 2013 Aug 28;8(8):e72287. doi: 10.1371/journal.pone.0072287. eCollection 2013.","PLoS One.  2013","PubMed","citation","PMID:24015230 | PMCID:PMC3756056","pubmed","24015230","create date:2013/09/10 | first author:Hu Y",
"Comparative sex chromosome genomics in snakes: differentiation, evolutionary strata, and lack of global dosage compensation.","/pubmed/24015111","Vicoso B, Emerson JJ, Zektser Y, Mahajan S, Bachtrog D.","PLoS Biol. 2013;11(8):e1001643. doi: 10.1371/journal.pbio.1001643. Epub 2013 Aug 27.","PLoS Biol.  2013","PubMed","citation","PMID:24015111 | PMCID:PMC3754893","pubmed","24015111","create date:2013/09/10 | first author:Vicoso B",
"Heritability and inter-population differences in lipid profiles of Drosophila melanogaster.","/pubmed/24013349","Scheitz CJ, Guo Y, Early AM, Harshman LG, Clark AG.","PLoS One. 2013 Aug 27;8(8):e72726. doi: 10.1371/journal.pone.0072726. eCollection 2013.","PLoS One.  2013","PubMed","citation","PMID:24013349 | PMCID:PMC3754969","pubmed","24013349","create date:2013/09/10 | first author:Scheitz CJ",
"In vivo expression technology identifies a novel virulence factor critical for Borrelia burgdorferi persistence in mice.","/pubmed/24009501","Ellis TC, Jain S, Linowski AK, Rike K, Bestor A, Rosa PA, Halpern M, Kurhanewicz S, Jewett MW.","PLoS Pathog. 2013;9(8):e1003567. doi: 10.1371/journal.ppat.1003567. Epub 2013 Aug 29. Erratum in: PLoS Pathog. 2014 Jun;10(6). doi:10.1371/journal.ppat.1004260.  Corrected and republished in: PLoS Pathog. 2014 Jun;10(6):e1004260. ","PLoS Pathog.  2013","PubMed","citation","PMID:24009501 | PMCID:PMC3757035","pubmed","24009501","create date:2013/09/07 | first author:Ellis TC",
"Functionalization-dependent induction of cellular survival pathways by CdSe quantum dots in primary normal human bronchial epithelial cells.","/pubmed/24007210","Nagy A, Hollingsworth JA, Hu B, Steinbrück A, Stark PC, Rios Valdez C, Vuyisich M, Stewart MH, Atha DH, Nelson BC, Iyer R.","ACS Nano. 2013 Oct 22;7(10):8397-411. doi: 10.1021/nn305532k. Epub 2013 Sep 17.","ACS Nano.  2013","PubMed","citation","PMID:24007210","pubmed","24007210","create date:2013/09/07 | first author:Nagy A",
"IL-4 attenuates Th1-associated chemokine expression and Th1 trafficking to inflamed tissues and limits pathogen clearance.","/pubmed/23991011","Lazarski CA, Ford J, Katzman SD, Rosenberg AF, Fowell DJ.","PLoS One. 2013 Aug 26;8(8):e71949. doi: 10.1371/journal.pone.0071949. eCollection 2013.","PLoS One.  2013","PubMed","citation","PMID:23991011 | PMCID:PMC3753298","pubmed","23991011","create date:2013/08/31 | first author:Lazarski CA",
"Cytoplasmic polyadenylation is a major mRNA regulator during oogenesis and egg activation in Drosophila.","/pubmed/23978535","Cui J, Sartain CV, Pleiss JA, Wolfner MF.","Dev Biol. 2013 Nov 1;383(1):121-31. doi: 10.1016/j.ydbio.2013.08.013. Epub 2013 Aug 23.","Dev Biol.  2013","PubMed","citation","PMID:23978535 | PMCID:PMC3821703","pubmed","23978535","create date:2013/08/28 | first author:Cui J",
Title,URL,Description,Details,ShortDetails,Resource,Type,Identifiers,Db,EntrezUID,Properties
"Functional genomic analyses of two morphologically distinct classes of Drosophila sensory neurons: post-mitotic roles of transcription factors in dendritic patterning.","/pubmed/23977298","Iyer EP, Iyer SC, Sullivan L, Wang D, Meduri R, Graybeal LL, Cox DN.","PLoS One. 2013 Aug 15;8(8):e72434. doi: 10.1371/journal.pone.0072434. eCollection 2013.","PLoS One.  2013","PubMed","citation","PMID:23977298 | PMCID:PMC3744488","pubmed","23977298","create date:2013/08/27 | first author:Iyer EP",
"Novel biomarkers of arterial and venous ischemia in microvascular flaps.","/pubmed/23977093","Nguyen GK, Hwang BH, Zhang Y, Monahan JF, Davis GB, Lee YS, Ragina NP, Wang C, Zhou ZY, Hong YK, Spivak RM, Wong AK.","PLoS One. 2013 Aug 14;8(8):e71628. doi: 10.1371/journal.pone.0071628. eCollection 2013.","PLoS One.  2013","PubMed","citation","PMID:23977093 | PMCID:PMC3743756","pubmed","23977093","create date:2013/08/27 | first author:Nguyen GK",
"Age-related modulation of the effects of obesity on gene expression profiles of mouse bone marrow and epididymal adipocytes.","/pubmed/23967297","Liu LF, Shen WJ, Ueno M, Patel S, Azhar S, Kraemer FB.","PLoS One. 2013 Aug 14;8(8):e72367. doi: 10.1371/journal.pone.0072367. eCollection 2013.","PLoS One.  2013","PubMed","citation","PMID:23967297 | PMCID:PMC3743818","pubmed","23967297","create date:2013/08/24 | first author:Liu LF",
"An exploration of heat tolerance in mice utilizing mRNA and microRNA expression analysis.","/pubmed/23967293","Islam A, Deuster PA, Devaney JM, Ghimbovschi S, Chen Y.","PLoS One. 2013 Aug 15;8(8):e72258. doi: 10.1371/journal.pone.0072258. eCollection 2013.","PLoS One.  2013","PubMed","citation","PMID:23967293 | PMCID:PMC3744453","pubmed","23967293","create date:2013/08/24 | first author:Islam A",
"Discovery of J chain in African lungfish (Protopterus dolloi, Sarcopterygii) using high throughput transcriptome sequencing: implications in mucosal immunity.","/pubmed/23967082","Tacchi L, Larragoite E, Salinas I.","PLoS One. 2013 Aug 14;8(8):e70650. doi: 10.1371/journal.pone.0070650. eCollection 2013.","PLoS One.  2013","PubMed","citation","PMID:23967082 | PMCID:PMC3743840","pubmed","23967082","create date:2013/08/24 | first author:Tacchi L",
"Transcript profiling identifies iqgap2(-/-) mouse as a model for advanced human hepatocellular carcinoma.","/pubmed/23951254","Gnatenko DV, Xu X, Zhu W, Schmidt VA.","PLoS One. 2013 Aug 12;8(8):e71826. doi: 10.1371/journal.pone.0071826. eCollection 2013.","PLoS One.  2013","PubMed","citation","PMID:23951254 | PMCID:PMC3741273","pubmed","23951254","create date:2013/08/21 | first author:Gnatenko DV",
"Sequencing mRNA from cryo-sliced Drosophila embryos to determine genome-wide spatial patterns of gene expression.","/pubmed/23951250","Combs PA, Eisen MB.","PLoS One. 2013 Aug 12;8(8):e71820. doi: 10.1371/journal.pone.0071820. eCollection 2013.","PLoS One.  2013","PubMed","citation","PMID:23951250 | PMCID:PMC3741199","pubmed","23951250","create date:2013/08/21 | first author:Combs PA",
"A genome-wide survey of highly expressed non-coding RNAs and biological validation of selected candidates in Agrobacterium tumefaciens.","/pubmed/23950988","Lee K, Huang X, Yang C, Lee D, Ho V, Nobuta K, Fan JB, Wang K.","PLoS One. 2013 Aug 8;8(8):e70720. doi: 10.1371/journal.pone.0070720. eCollection 2013.","PLoS One.  2013","PubMed","citation","PMID:23950988 | PMCID:PMC3738593","pubmed","23950988","create date:2013/08/21 | first author:Lee K",
"Long-term artificial sweetener acesulfame potassium treatment alters neurometabolic functions in C57BL/6J mice.","/pubmed/23950916","Cong WN, Wang R, Cai H, Daimon CM, Scheibye-Knudsen M, Bohr VA, Turkin R, Wood WH 3rd, Becker KG, Moaddel R, Maudsley S, Martin B.","PLoS One. 2013 Aug 7;8(8):e70257. doi: 10.1371/journal.pone.0070257. eCollection 2013.","PLoS One.  2013","PubMed","citation","PMID:23950916 | PMCID:PMC3737213","pubmed","23950916","create date:2013/08/21 | first author:Cong WN",
"Sarcoptes scabiei mites modulate gene expression in human skin equivalents.","/pubmed/23940705","Morgan MS, Arlian LG, Markey MP.","PLoS One. 2013 Aug 5;8(8):e71143. doi: 10.1371/journal.pone.0071143. Print 2013.","PLoS One.  2013","PubMed","citation","PMID:23940705 | PMCID:PMC3733868","pubmed","23940705","create date:2013/08/14 | first author:Morgan MS",
"Exposure of clinical MRSA heterogeneous strains to β-lactams redirects metabolism to optimize energy production through the TCA cycle.","/pubmed/23940684","Keaton MA, Rosato RR, Plata KB, Singh CR, Rosato AE.","PLoS One. 2013 Aug 5;8(8):e71025. doi: 10.1371/journal.pone.0071025. Print 2013.","PLoS One.  2013","PubMed","citation","PMID:23940684 | PMCID:PMC3733780","pubmed","23940684","create date:2013/08/14 | first author:Keaton MA",
"STAT3 activation promotes oncolytic HSV1 replication in glioma cells.","/pubmed/23936533","Okemoto K, Wagner B, Meisen H, Haseley A, Kaur B, Chiocca EA.","PLoS One. 2013 Aug 2;8(8):e71932. doi: 10.1371/journal.pone.0071932. Print 2013.","PLoS One.  2013","PubMed","citation","PMID:23936533 | PMCID:PMC3732216","pubmed","23936533","create date:2013/08/13 | first author:Okemoto K",
"Gene expression-based biomarkers for Anopheles gambiae age grading.","/pubmed/23936017","Wang MH, Marinotti O, Zhong D, James AA, Walker E, Guda T, Kweka EJ, Githure J, Yan G.","PLoS One. 2013 Jul 23;8(7):e69439. doi: 10.1371/journal.pone.0069439. Print 2013.","PLoS One.  2013","PubMed","citation","PMID:23936017 | PMCID:PMC3720620","pubmed","23936017","create date:2013/08/13 | first author:Wang MH",
"A network integration approach to predict conserved regulators related to pathogenicity of influenza and SARS-CoV respiratory viruses.","/pubmed/23935999","Mitchell HD, Eisfeld AJ, Sims AC, McDermott JE, Matzke MM, Webb-Robertson BJ, Tilton SC, Tchitchek N, Josset L, Li C, Ellis AL, Chang JH, Heegel RA, Luna ML, Schepmoes AA, Shukla AK, Metz TO, Neumann G, Benecke AG, Smith RD, Baric RS, Kawaoka Y, et al.","PLoS One. 2013 Jul 25;8(7):e69374. doi: 10.1371/journal.pone.0069374. Print 2013.","PLoS One.  2013","PubMed","citation","PMID:23935999 | PMCID:PMC3723910","pubmed","23935999","create date:2013/08/13 | first author:Mitchell HD",
"Multi-study integration of brain cancer transcriptomes reveals organ-level molecular signatures.","/pubmed/23935471","Sung J, Kim PJ, Ma S, Funk CC, Magis AT, Wang Y, Hood L, Geman D, Price ND.","PLoS Comput Biol. 2013;9(7):e1003148. doi: 10.1371/journal.pcbi.1003148. Epub 2013 Jul 25.","PLoS Comput Biol.  2013","PubMed","citation","PMID:23935471 | PMCID:PMC3723500","pubmed","23935471","create date:2013/08/13 | first author:Sung J",
"De novo assembly and characterization of two transcriptomes reveal multiple light-mediated functions in the scallop eye (Bivalvia: Pectinidae).","/pubmed/23922823","Pairett AN, Serb JM.","PLoS One. 2013 Jul 29;8(7):e69852. doi: 10.1371/journal.pone.0069852. Print 2013.","PLoS One.  2013","PubMed","citation","PMID:23922823 | PMCID:PMC3726758","pubmed","23922823","create date:2013/08/08 | first author:Pairett AN",
"Differential expression of functional Fc-receptors and additional immune complex receptors on mouse kidney cells.","/pubmed/23911392","Suwanichkul A, Wenderfer SE.","Mol Immunol. 2013 Dec;56(4):369-79. doi: 10.1016/j.molimm.2013.05.219. Epub 2013 Aug 1.","Mol Immunol.  2013","PubMed","citation","PMID:23911392 | PMCID:PMC3799920","pubmed","23911392","create date:2013/08/06 | first author:Suwanichkul A",
"Primary respiratory chain disease causes tissue-specific dysregulation of the global transcriptome and nutrient-sensing signaling network.","/pubmed/23894440","Zhang Z, Tsukikawa M, Peng M, Polyak E, Nakamaru-Ogiso E, Ostrovsky J, McCormack S, Place E, Clarke C, Reiner G, McCormick E, Rappaport E, Haas R, Baur JA, Falk MJ.","PLoS One. 2013 Jul 24;8(7):e69282. doi: 10.1371/journal.pone.0069282. Print 2013.","PLoS One.  2013","PubMed","citation","PMID:23894440 | PMCID:PMC3722174","pubmed","23894440","create date:2013/07/31 | first author:Zhang Z",
"Systems biology analysis of Zymomonas mobilis ZM4 ethanol stress responses.","/pubmed/23874800","Yang S, Pan C, Tschaplinski TJ, Hurst GB, Engle NL, Zhou W, Dam P, Xu Y, Rodriguez M Jr, Dice L, Johnson CM, Davison BH, Brown SD.","PLoS One. 2013 Jul 16;8(7):e68886. doi: 10.1371/journal.pone.0068886. Print 2013. Erratum in: PLoS One. 2014;9(6):e101305. ","PLoS One.  2013","PubMed","citation","PMID:23874800 | PMCID:PMC3712917","pubmed","23874800","create date:2013/07/23 | first author:Yang S",
"Comparison of profile similarity measures for genetic interaction networks.","/pubmed/23874711","Deshpande R, Vandersluis B, Myers CL.","PLoS One. 2013 Jul 10;8(7):e68664. doi: 10.1371/journal.pone.0068664. Print 2013.","PLoS One.  2013","PubMed","citation","PMID:23874711 | PMCID:PMC3707826","pubmed","23874711","create date:2013/07/23 | first author:Deshpande R",
"N-terminal truncated intracellular matrix metalloproteinase-2 induces cardiomyocyte hypertrophy, inflammation and systolic heart failure.","/pubmed/23874529","Lovett DH, Mahimkar R, Raffai RL, Cape L, Zhu BQ, Jin ZQ, Baker AJ, Karliner JS.","PLoS One. 2013 Jul 16;8(7):e68154. doi: 10.1371/journal.pone.0068154. Print 2013.","PLoS One.  2013","PubMed","citation","PMID:23874529 | PMCID:PMC3712965","pubmed","23874529","create date:2013/07/23 | first author:Lovett DH",
"Headcase promotes cell survival and niche maintenance in the Drosophila testis.","/pubmed/23874487","Resende LP, Boyle M, Tran D, Fellner T, Jones DL.","PLoS One. 2013 Jul 9;8(7):e68026. doi: 10.1371/journal.pone.0068026. Print 2013.","PLoS One.  2013","PubMed","citation","PMID:23874487 | PMCID:PMC3706621","pubmed","23874487","create date:2013/07/23 | first author:Resende LP",
"Gene expression analysis of zebrafish melanocytes, iridophores, and retinal pigmented epithelium reveals indicators of biological function and developmental origin.","/pubmed/23874447","Higdon CW, Mitra RD, Johnson SL.","PLoS One. 2013 Jul 9;8(7):e67801. doi: 10.1371/journal.pone.0067801. Print 2013.","PLoS One.  2013","PubMed","citation","PMID:23874447 | PMCID:PMC3706446","pubmed","23874447","create date:2013/07/23 | first author:Higdon CW",
