Title,URL,Description,Details,ShortDetails,Resource,Type,Identifiers,Db,EntrezUID,Properties
"Profiling of exome mutations associated with progression of HBV-related hepatocellular carcinoma.","/pubmed/25521761","Woo HG, Kim SS, Cho H, Kwon SM, Cho HJ, Ahn SJ, Park ES, Lee JS, Cho SW, Cheong JY.","PLoS One. 2014 Dec 18;9(12):e115152. doi: 10.1371/journal.pone.0115152. eCollection 2014.","PLoS One.  2014","PubMed","citation","PMID:25521761 | PMCID:PMC4270755","pubmed","25521761","create date:2014/12/19 | first author:Woo HG",
"Cellular oxidative stress response controls the antiviral and apoptotic programs in dengue virus-infected dendritic cells.","/pubmed/25521078","Olagnier D, Peri S, Steel C, van Montfoort N, Chiang C, Beljanski V, Slifker M, He Z, Nichols CN, Lin R, Balachandran S, Hiscott J.","PLoS Pathog. 2014 Dec 18;10(12):e1004566. doi: 10.1371/journal.ppat.1004566. eCollection 2014 Dec.","PLoS Pathog.  2014","PubMed","citation","PMID:25521078 | PMCID:PMC4270780","pubmed","25521078","create date:2014/12/19 | first author:Olagnier D",
"Gene expression study in positron emission tomography-positive abdominal aortic aneurysms identifies CCL18 as a potential biomarker for rupture risk.","/pubmed/25517227","Courtois A, Nusgens BV, Hustinx R, Namur G, Gomez P, Kuivaniemi H, Defraigne JO, Colige AC, Sakalihasan N.","Mol Med. 2015 Mar 24;20:697-706. doi: 10.2119/molmed.2014.00065.","Mol Med.  2015","PubMed","citation","PMID:25517227 | PMCID:PMC4398666","pubmed","25517227","create date:2014/12/18 | first author:Courtois A",
"DNA methylation profile and expression of surfactant protein A2 gene in lung cancer.","/pubmed/25514367","Grageda M, Silveyra P, Thomas NJ, DiAngelo SL, Floros J.","Exp Lung Res. 2015 Mar;41(2):93-102. doi: 10.3109/01902148.2014.976298. Epub 2014 Dec 16.","Exp Lung Res.  2015","PubMed","citation","PMID:25514367 | PMCID:PMC4336205","pubmed","25514367","create date:2014/12/17 | first author:Grageda M",
"Light-promoted rhodopsin expression and starvation survival in the marine dinoflagellate Oxyrrhis marina.","/pubmed/25506945","Guo Z, Zhang H, Lin S.","PLoS One. 2014 Dec 15;9(12):e114941. doi: 10.1371/journal.pone.0114941. eCollection 2014.","PLoS One.  2014","PubMed","citation","PMID:25506945 | PMCID:PMC4266641","pubmed","25506945","create date:2014/12/17 | first author:Guo Z",
"Identifying and validating a combined mRNA and microRNA signature in response to imatinib treatment in a chronic myeloid leukemia cell line.","/pubmed/25506832","Bhutra S, Lenkala D, LaCroix B, Ye M, Huang RS.","PLoS One. 2014 Dec 15;9(12):e115003. doi: 10.1371/journal.pone.0115003. eCollection 2014.","PLoS One.  2014","PubMed","citation","PMID:25506832 | PMCID:PMC4266614","pubmed","25506832","create date:2014/12/17 | first author:Bhutra S",
"Transcriptional profiles of host-pathogen responses to necrotic enteritis and differential regulation of immune genes in two inbreed chicken lines showing disparate disease susceptibility.","/pubmed/25504150","Kim DK, Lillehoj HS, Jang SI, Lee SH, Hong YH, Cheng HH.","PLoS One. 2014 Dec 11;9(12):e114960. doi: 10.1371/journal.pone.0114960. eCollection 2014.","PLoS One.  2014","PubMed","citation","PMID:25504150 | PMCID:PMC4263703","pubmed","25504150","create date:2014/12/17 | first author:Kim DK",
"Developmental programming of long non-coding RNAs during postnatal liver maturation in mice.","/pubmed/25503252","Peng L, Paulson A, Li H, Piekos S, He X, Li L, Zhong XB.","PLoS One. 2014 Dec 11;9(12):e114917. doi: 10.1371/journal.pone.0114917. eCollection 2014.","PLoS One.  2014","PubMed","citation","PMID:25503252 | PMCID:PMC4263710","pubmed","25503252","create date:2014/12/17 | first author:Peng L",
"Use of a Guinea pig-specific transcriptome array for evaluation of protective immunity against genital chlamydial infection following intranasal vaccination in Guinea pigs.","/pubmed/25502875","Wali S, Gupta R, Veselenak RL, Li Y, Yu JJ, Murthy AK, Cap AP, Guentzel MN, Chambers JP, Zhong G, Rank RG, Pyles RB, Arulanandam BP.","PLoS One. 2014 Dec 11;9(12):e114261. doi: 10.1371/journal.pone.0114261. eCollection 2014.","PLoS One.  2014","PubMed","citation","PMID:25502875 | PMCID:PMC4263467","pubmed","25502875","create date:2014/12/17 | first author:Wali S",
"Gene expression of corals in response to macroalgal competitors.","/pubmed/25500576","Shearer TL, Snell TW, Hay ME.","PLoS One. 2014 Dec 12;9(12):e114525. doi: 10.1371/journal.pone.0114525. eCollection 2014.","PLoS One.  2014","PubMed","citation","PMID:25500576 | PMCID:PMC4264762","pubmed","25500576","create date:2014/12/17 | first author:Shearer TL",
"Heterochromatin assembly and transcriptome repression by Set1 in coordination with a class II histone deacetylase.","/pubmed/25497836","Lorenz DR, Meyer LF, Grady PJ, Meyer MM, Cam HP.","Elife. 2014 Dec 15;3:e04506. doi: 10.7554/eLife.04506.","Elife.  2014","PubMed","citation","PMID:25497836 | PMCID:PMC4383021","pubmed","25497836","create date:2014/12/17 | first author:Lorenz DR",
"Natural Variation in Fish Transcriptomes: Comparative Analysis of the Fathead Minnow (Pimephales promelas) and Zebrafish (Danio rerio).","/pubmed/25493933","Wang RL, Bencic DC, Garcia-Reyero N, Perkins EJ, Villeneuve DL, Ankley GT, Biales AD.","PLoS One. 2014 Dec 10;9(12):e114178. doi: 10.1371/journal.pone.0114178. eCollection 2014.","PLoS One.  2014","PubMed","citation","PMID:25493933 | PMCID:PMC4262388","pubmed","25493933","create date:2014/12/11 | first author:Wang RL",
"Genome-wide regulatory dynamics of translation in the Plasmodium falciparum asexual blood stages.","/pubmed/25493618","Caro F, Ahyong V, Betegon M, DeRisi JL.","Elife. 2014 Dec 10;3. doi: 10.7554/eLife.04106.","Elife.  2014","PubMed","citation","PMID:25493618 | PMCID:PMC4371882","pubmed","25493618","create date:2014/12/11 | first author:Caro F",
"Transcriptome sequencing reveals the virulence and environmental genetic programs of Vibrio vulnificus exposed to host and estuarine conditions.","/pubmed/25489854","Williams TC, Blackman ER, Morrison SS, Gibas CJ, Oliver JD.","PLoS One. 2014 Dec 9;9(12):e114376. doi: 10.1371/journal.pone.0114376. eCollection 2014.","PLoS One.  2014","PubMed","citation","PMID:25489854 | PMCID:PMC4260858","pubmed","25489854","create date:2014/12/10 | first author:Williams TC",
"Molecular cloning, characterization and positively selected sites of the glutathione S-transferase family from Locusta migratoria.","/pubmed/25486043","Zhang X, Wang J, Zhang M, Qin G, Li D, Zhu KY, Ma E, Zhang J.","PLoS One. 2014 Dec 8;9(12):e114776. doi: 10.1371/journal.pone.0114776. eCollection 2014.","PLoS One.  2014","PubMed","citation","PMID:25486043 | PMCID:PMC4259467","pubmed","25486043","create date:2014/12/09 | first author:Zhang X",
"Expression profiles of Fsh-regulated ovarian genes during oogenesis in coho salmon.","/pubmed/25485989","Guzmán JM, Luckenbach JA, Yamamoto Y, Swanson P.","PLoS One. 2014 Dec 8;9(12):e114176. doi: 10.1371/journal.pone.0114176. eCollection 2014.","PLoS One.  2014","PubMed","citation","PMID:25485989 | PMCID:PMC4259363","pubmed","25485989","create date:2014/12/09 | first author:Guzmán JM",
"The transcriptome of Legionella pneumophila-infected human monocyte-derived macrophages.","/pubmed/25485627","Price CT, Abu Kwaik Y.","PLoS One. 2014 Dec 8;9(12):e114914. doi: 10.1371/journal.pone.0114914. eCollection 2014.","PLoS One.  2014","PubMed","citation","PMID:25485627 | PMCID:PMC4259488","pubmed","25485627","create date:2014/12/09 | first author:Price CT",
"Molecular and cellular characterization of a zebrafish optic pathway tumor line implicates glia-derived progenitors in tumorigenesis.","/pubmed/25485542","Solin SL, Wang Y, Mauldin J, Schultz LE, Lincow DE, Brodskiy PA, Jones CA, Syrkin-Nikolau J, Linn JM, Essner JJ, Hostetter JM, Whitley EM, Cameron JD, Chou HH, Severin AJ, Sakaguchi DS, McGrail M.","PLoS One. 2014 Dec 8;9(12):e114888. doi: 10.1371/journal.pone.0114888. eCollection 2014.","PLoS One.  2014","PubMed","citation","PMID:25485542 | PMCID:PMC4259487","pubmed","25485542","create date:2014/12/09 | first author:Solin SL",
"Quantitative bacterial transcriptomics with RNA-seq.","/pubmed/25483350","Creecy JP, Conway T.","Curr Opin Microbiol. 2015 Feb;23:133-40. doi: 10.1016/j.mib.2014.11.011. Epub 2014 Dec 5. Review.","Curr Opin Microbiol.  2015","PubMed","citation","PMID:25483350 | PMCID:PMC4323862","pubmed","25483350","create date:2014/12/09 | first author:Creecy JP",
"Phylogenetic and transcriptomic analyses reveal the evolution of bioluminescence and light detection in marine deep-sea shrimps of the family Oplophoridae (Crustacea: Decapoda).","/pubmed/25482362","Wong JM, Pérez-Moreno JL, Chan TY, Frank TM, Bracken-Grissom HD.","Mol Phylogenet Evol. 2015 Feb;83:278-92. doi: 10.1016/j.ympev.2014.11.013. Epub 2014 Dec 4.","Mol Phylogenet Evol.  2015","PubMed","citation","PMID:25482362","pubmed","25482362","create date:2014/12/09 | first author:Wong JM",
"Identification of a novel isoform of the leukemia-associated MLLT1 (ENL/LTG19) protein.","/pubmed/25481096","Wallingford MC, Filkins R, Adams D, Walentuk M, Salicioni AM, Visconti PE, Mager J.","Gene Expr Patterns. 2015 Jan;17(1):11-5. doi: 10.1016/j.gep.2014.11.003. Epub 2014 Dec 3.","Gene Expr Patterns.  2015","PubMed","citation","PMID:25481096","pubmed","25481096","create date:2014/12/08 | first author:Wallingford MC",
"Genetic and functional studies of the intervertebral disc: a novel murine intervertebral disc model.","/pubmed/25474689","Pelle DW, Peacock JD, Schmidt CL, Kampfschulte K, Scholten DJ 2nd, Russo SS, Easton KJ, Steensma MR.","PLoS One. 2014 Dec 4;9(12):e112454. doi: 10.1371/journal.pone.0112454. eCollection 2014.","PLoS One.  2014","PubMed","citation","PMID:25474689 | PMCID:PMC4256369","pubmed","25474689","create date:2014/12/05 | first author:Pelle DW",
"Analysis of the Phlebiopsis gigantea genome, transcriptome and secretome provides insight into its pioneer colonization strategies of wood.","/pubmed/25474575","Hori C, Ishida T, Igarashi K, Samejima M, Suzuki H, Master E, Ferreira P, Ruiz-Dueñas FJ, Held B, Canessa P, Larrondo LF, Schmoll M, Druzhinina IS, Kubicek CP, Gaskell JA, Kersten P, St John F, Glasner J, Sabat G, Splinter BonDurant S, Syed K, Yadav J, et al.","PLoS Genet. 2014 Dec 4;10(12):e1004759. doi: 10.1371/journal.pgen.1004759. eCollection 2014 Dec.","PLoS Genet.  2014","PubMed","citation","PMID:25474575 | PMCID:PMC4256170","pubmed","25474575","create date:2014/12/05 | first author:Hori C",
"An updated insight into the Sialotranscriptome of Triatoma infestans: developmental stage and geographic variations.","/pubmed/25474469","Schwarz A, Medrano-Mercado N, Schaub GA, Struchiner CJ, Bargues MD, Levy MZ, Ribeiro JM.","PLoS Negl Trop Dis. 2014 Dec 4;8(12):e3372. doi: 10.1371/journal.pntd.0003372. eCollection 2014 Dec.","PLoS Negl Trop Dis.  2014","PubMed","citation","PMID:25474469 | PMCID:PMC4256203","pubmed","25474469","create date:2014/12/05 | first author:Schwarz A",
"Immune status, strain background, and anatomic site of inoculation affect mouse papillomavirus (MmuPV1) induction of exophytic papillomas or endophytic trichoblastomas.","/pubmed/25474466","Sundberg JP, Stearns TM, Joh J, Proctor M, Ingle A, Silva KA, Dadras SS, Jenson AB, Ghim SJ.","PLoS One. 2014 Dec 4;9(12):e113582. doi: 10.1371/journal.pone.0113582. eCollection 2014.","PLoS One.  2014","PubMed","citation","PMID:25474466 | PMCID:PMC4256377","pubmed","25474466","create date:2014/12/05 | first author:Sundberg JP",
"Epigenome-guided analysis of the transcriptome of plaque macrophages during atherosclerosis regression reveals activation of the Wnt signaling pathway.","/pubmed/25474352","Ramsey SA, Vengrenyuk Y, Menon P, Podolsky I, Feig JE, Aderem A, Fisher EA, Gold ES.","PLoS Genet. 2014 Dec 4;10(12):e1004828. doi: 10.1371/journal.pgen.1004828. eCollection 2014 Dec.","PLoS Genet.  2014","PubMed","citation","PMID:25474352 | PMCID:PMC4256277","pubmed","25474352","create date:2014/12/05 | first author:Ramsey SA",
"Interleukin-1 and interferon-γ orchestrate β-glucan-activated human dendritic cell programming via IκB-ζ modulation.","/pubmed/25474109","Cardone M, Dzutsev AK, Li H, Riteau N, Gerosa F, Shenderov K, Winkler-Pickett R, Provezza L, Riboldi E, Leighty RM, Orr SJ, Steinhagen F, Wewers MD, Sher A, Anderson SK, Goldszmid R, McVicar DW, Lyakh L, Trinchieri G.","PLoS One. 2014 Dec 4;9(12):e114516. doi: 10.1371/journal.pone.0114516. eCollection 2014.","PLoS One.  2014","PubMed","citation","PMID:25474109 | PMCID:PMC4256441","pubmed","25474109","create date:2014/12/05 | first author:Cardone M",
"Microevolution of Candida albicans in macrophages restores filamentation in a nonfilamentous mutant.","/pubmed/25474009","Wartenberg A, Linde J, Martin R, Schreiner M, Horn F, Jacobsen ID, Jenull S, Wolf T, Kuchler K, Guthke R, Kurzai O, Forche A, d'Enfert C, Brunke S, Hube B.","PLoS Genet. 2014 Dec 4;10(12):e1004824. doi: 10.1371/journal.pgen.1004824. eCollection 2014 Dec.","PLoS Genet.  2014","PubMed","citation","PMID:25474009 | PMCID:PMC4256171","pubmed","25474009","create date:2014/12/05 | first author:Wartenberg A",
"Impact of the genetic background on the composition of the chicken plasma MiRNome in response to a stress.","/pubmed/25473826","Ahanda ML, Zerjal T, Dhorne-Pollet S, Rau A, Cooksey A, Giuffra E.","PLoS One. 2014 Dec 4;9(12):e114598. doi: 10.1371/journal.pone.0114598. eCollection 2014.","PLoS One.  2014","PubMed","citation","PMID:25473826 | PMCID:PMC4256448","pubmed","25473826","create date:2014/12/05 | first author:Ahanda ML",
"Targeted exon sequencing in Usher syndrome type I.","/pubmed/25468891","Bujakowska KM, Consugar M, Place E, Harper S, Lena J, Taub DG, White J, Navarro-Gomez D, Weigel DiFranco C, Farkas MH, Gai X, Berson EL, Pierce EA.","Invest Ophthalmol Vis Sci. 2014 Dec 2;55(12):8488-96. doi: 10.1167/iovs.14-15169.","Invest Ophthalmol Vis Sci.  2014","PubMed","citation","PMID:25468891 | PMCID:PMC4280089","pubmed","25468891","create date:2014/12/04 | first author:Bujakowska KM",
"Differential proteomic analysis of endemic and sporadic Epstein-Barr virus-positive and negative Burkitt lymphoma.","/pubmed/25466511","El-Mallawany NK, Day N, Ayello J, Van de Ven C, Conlon K, Fermin D, Basrur V, Elenitoba-Johnson K, Lim M, Cairo MS.","Eur J Cancer. 2015 Jan;51(1):92-100. doi: 10.1016/j.ejca.2014.10.017. Epub 2014 Nov 6.","Eur J Cancer.  2015","PubMed","citation","PMID:25466511","pubmed","25466511","create date:2014/12/04 | first author:El-Mallawany NK",
"Rapid prototyping of microbial cell factories via genome-scale engineering.","/pubmed/25450192","Si T, Xiao H, Zhao H.","Biotechnol Adv. 2015 Nov 15;33(7):1420-32. doi: 10.1016/j.biotechadv.2014.11.007. Epub 2014 Nov 20. Review.","Biotechnol Adv.  2015","PubMed","citation","PMID:25450192 | PMCID:PMC4439387","pubmed","25450192","create date:2014/12/03 | first author:Si T",
"LuxS signaling in Porphyromonas gingivalis-host interactions.","/pubmed/25434960","Scheres N, Lamont RJ, Crielaard W, Krom BP.","Anaerobe. 2015 Oct;35(Pt A):3-9. doi: 10.1016/j.anaerobe.2014.11.011. Epub 2014 Nov 28.","Anaerobe.  2015","PubMed","citation","PMID:25434960","pubmed","25434960","create date:2014/12/02 | first author:Scheres N",
Title,URL,Description,Details,ShortDetails,Resource,Type,Identifiers,Db,EntrezUID,Properties
"Pathophysiologic and transcriptomic analyses of viscerotropic yellow fever in a rhesus macaque model.","/pubmed/25412185","Engelmann F, Josset L, Girke T, Park B, Barron A, Dewane J, Hammarlund E, Lewis A, Axthelm MK, Slifka MK, Messaoudi I.","PLoS Negl Trop Dis. 2014 Nov 20;8(11):e3295. doi: 10.1371/journal.pntd.0003295. eCollection 2014.","PLoS Negl Trop Dis.  2014","PubMed","citation","PMID:25412185 | PMCID:PMC4238990","pubmed","25412185","create date:2014/11/21 | first author:Engelmann F",
"An RNA-seq screen of the Drosophila antenna identifies a transporter necessary for ammonia detection.","/pubmed/25412082","Menuz K, Larter NK, Park J, Carlson JR.","PLoS Genet. 2014 Nov 20;10(11):e1004810. doi: 10.1371/journal.pgen.1004810. eCollection 2014 Nov.","PLoS Genet.  2014","PubMed","citation","PMID:25412082 | PMCID:PMC4238959","pubmed","25412082","create date:2014/11/21 | first author:Menuz K",
"Development of an OP9 derived cell line as a robust model to rapidly study adipocyte differentiation.","/pubmed/25409310","Lane JM, Doyle JR, Fortin JP, Kopin AS, Ordovás JM.","PLoS One. 2014 Nov 19;9(11):e112123. doi: 10.1371/journal.pone.0112123. eCollection 2014.","PLoS One.  2014","PubMed","citation","PMID:25409310 | PMCID:PMC4237323","pubmed","25409310","create date:2014/11/20 | first author:Lane JM",
"The genome of the generalist plant pathogen Fusarium avenaceum is enriched with genes involved in redox, signaling and secondary metabolism.","/pubmed/25409087","Lysøe E, Harris LJ, Walkowiak S, Subramaniam R, Divon HH, Riiser ES, Llorens C, Gabaldón T, Kistler HC, Jonkers W, Kolseth AK, Nielsen KF, Thrane U, Frandsen RJ.","PLoS One. 2014 Nov 19;9(11):e112703. doi: 10.1371/journal.pone.0112703. eCollection 2014.","PLoS One.  2014","PubMed","citation","PMID:25409087 | PMCID:PMC4237347","pubmed","25409087","create date:2014/11/20 | first author:Lysøe E",
"Transcriptome-based identification of ABC transporters in the western tarnished plant bug Lygus hesperus.","/pubmed/25401762","Hull JJ, Chaney K, Geib SM, Fabrick JA, Brent CS, Walsh D, Lavine LC.","PLoS One. 2014 Nov 17;9(11):e113046. doi: 10.1371/journal.pone.0113046. eCollection 2014.","PLoS One.  2014","PubMed","citation","PMID:25401762 | PMCID:PMC4234516","pubmed","25401762","create date:2014/11/18 | first author:Hull JJ",
"Systematic identification of single amino acid variants in glioma stem-cell-derived chromosome 19 proteins.","/pubmed/25399873","Lichti CF, Mostovenko E, Wadsworth PA, Lynch GC, Pettitt BM, Sulman EP, Wang Q, Lang FF, Rezeli M, Marko-Varga G, Végvári Á, Nilsson CL.","J Proteome Res. 2015 Feb 6;14(2):778-86. doi: 10.1021/pr500810g. Epub 2014 Nov 25.","J Proteome Res.  2015","PubMed","citation","PMID:25399873 | PMCID:PMC4324435","pubmed","25399873","create date:2014/11/18 | first author:Lichti CF",
"Sequencing, annotation and analysis of the Syrian hamster (Mesocricetus auratus) transcriptome.","/pubmed/25398096","Tchitchek N, Safronetz D, Rasmussen AL, Martens C, Virtaneva K, Porcella SF, Feldmann H, Ebihara H, Katze MG.","PLoS One. 2014 Nov 14;9(11):e112617. doi: 10.1371/journal.pone.0112617. eCollection 2014. Erratum in: PLoS One. 2015;10(2):e0117958. ","PLoS One.  2014","PubMed","citation","PMID:25398096 | PMCID:PMC4232415","pubmed","25398096","create date:2014/11/15 | first author:Tchitchek N",
"Detection theory in identification of RNA-DNA sequence differences using RNA-sequencing.","/pubmed/25396741","Toung JM, Lahens N, Hogenesch JB, Grant G.","PLoS One. 2014 Nov 14;9(11):e112040. doi: 10.1371/journal.pone.0112040. eCollection 2014.","PLoS One.  2014","PubMed","citation","PMID:25396741 | PMCID:PMC4232354","pubmed","25396741","create date:2014/11/15 | first author:Toung JM",
"Distinct strains of Toxoplasma gondii feature divergent transcriptomes regardless of developmental stage.","/pubmed/25393307","Croken MM, Ma Y, Markillie LM, Taylor RC, Orr G, Weiss LM, Kim K.","PLoS One. 2014 Nov 13;9(11):e111297. doi: 10.1371/journal.pone.0111297. eCollection 2014.","PLoS One.  2014","PubMed","citation","PMID:25393307 | PMCID:PMC4230917","pubmed","25393307","create date:2014/11/14 | first author:Croken MM",
"Selection of reference genes for quantitative real-time PCR normalization in Panax ginseng at different stages of growth and in different organs.","/pubmed/25393243","Liu J, Wang Q, Sun M, Zhu L, Yang M, Zhao Y.","PLoS One. 2014 Nov 13;9(11):e112177. doi: 10.1371/journal.pone.0112177. eCollection 2014.","PLoS One.  2014","PubMed","citation","PMID:25393243 | PMCID:PMC4230945","pubmed","25393243","create date:2014/11/14 | first author:Liu J",
"Decitabine rescues cisplatin resistance in head and neck squamous cell carcinoma.","/pubmed/25391133","Viet CT, Dang D, Achdjian S, Ye Y, Katz SG, Schmidt BL.","PLoS One. 2014 Nov 12;9(11):e112880. doi: 10.1371/journal.pone.0112880. eCollection 2014.","PLoS One.  2014","PubMed","citation","PMID:25391133 | PMCID:PMC4229295","pubmed","25391133","create date:2014/11/13 | first author:Viet CT",
"Transcriptome of the invasive brown marmorated stink bug, Halyomorpha halys (Stål) (Heteroptera: Pentatomidae).","/pubmed/25386688","Sparks ME, Shelby KS, Kuhar D, Gundersen-Rindal DE.","PLoS One. 2014 Nov 11;9(11):e111646. doi: 10.1371/journal.pone.0111646. eCollection 2014.","PLoS One.  2014","PubMed","citation","PMID:25386688 | PMCID:PMC4227672","pubmed","25386688","create date:2014/11/12 | first author:Sparks ME",
"Differential antigen expression profile predicts immunoreactive subset of advanced ovarian cancers.","/pubmed/25380171","Eng KH, Tsuji T.","PLoS One. 2014 Nov 7;9(11):e111586. doi: 10.1371/journal.pone.0111586. eCollection 2014.","PLoS One.  2014","PubMed","citation","PMID:25380171 | PMCID:PMC4224408","pubmed","25380171","create date:2014/11/08 | first author:Eng KH",
"Systems level analysis and identification of pathways and networks associated with liver fibrosis.","/pubmed/25380136","AbdulHameed MD, Tawa GJ, Kumar K, Ippolito DL, Lewis JA, Stallings JD, Wallqvist A.","PLoS One. 2014 Nov 7;9(11):e112193. doi: 10.1371/journal.pone.0112193. eCollection 2014.","PLoS One.  2014","PubMed","citation","PMID:25380136 | PMCID:PMC4224449","pubmed","25380136","create date:2014/11/08 | first author:AbdulHameed MD",
"Identification of a metabolic biomarker panel in rats for prediction of acute and idiosyncratic hepatotoxicity.","/pubmed/25379137","Sun J, Slavov S, Schnackenberg LK, Ando Y, Greenhaw J, Yang X, Salminen W, Mendrick DL, Beger R.","Comput Struct Biotechnol J. 2014 Aug 9;10(17):78-89. doi: 10.1016/j.csbj.2014.08.001. eCollection 2014 Jul.","Comput Struct Biotechnol J.  2014","PubMed","citation","PMID:25379137 | PMCID:PMC4204381","pubmed","25379137","create date:2014/11/08 | first author:Sun J",
"Transcriptome analysis of the human corneal endothelium.","/pubmed/25377225","Frausto RF, Wang C, Aldave AJ.","Invest Ophthalmol Vis Sci. 2014 Nov 6;55(12):7821-30. doi: 10.1167/iovs.14-15021.","Invest Ophthalmol Vis Sci.  2014","PubMed","citation","PMID:25377225 | PMCID:PMC4258927","pubmed","25377225","create date:2014/11/08 | first author:Frausto RF",
"24-hour rhythms of DNA methylation and their relation with rhythms of RNA expression in the human dorsolateral prefrontal cortex.","/pubmed/25375876","Lim AS, Srivastava GP, Yu L, Chibnik LB, Xu J, Buchman AS, Schneider JA, Myers AJ, Bennett DA, De Jager PL.","PLoS Genet. 2014 Nov 6;10(11):e1004792. doi: 10.1371/journal.pgen.1004792. eCollection 2014 Nov.","PLoS Genet.  2014","PubMed","citation","PMID:25375876 | PMCID:PMC4222754","pubmed","25375876","create date:2014/11/07 | first author:Lim AS",
"ChIP-seq and in vivo transcriptome analyses of the Aspergillus fumigatus SREBP SrbA reveals a new regulator of the fungal hypoxia response and virulence.","/pubmed/25375670","Chung D, Barker BM, Carey CC, Merriman B, Werner ER, Lechner BE, Dhingra S, Cheng C, Xu W, Blosser SJ, Morohashi K, Mazurie A, Mitchell TK, Haas H, Mitchell AP, Cramer RA.","PLoS Pathog. 2014 Nov 6;10(11):e1004487. doi: 10.1371/journal.ppat.1004487. eCollection 2014 Nov. Erratum in: PLoS Pathog. 2014 Nov;10(11):e1004576. ","PLoS Pathog.  2014","PubMed","citation","PMID:25375670 | PMCID:PMC4223079","pubmed","25375670","create date:2014/11/07 | first author:Chung D",
"Transcriptomic analysis of the mussel Elliptio complanata identifies candidate stress-response genes and an abundance of novel or noncoding transcripts.","/pubmed/25375103","Cornman RS, Robertson LS, Galbraith H, Blakeslee C.","PLoS One. 2014 Nov 6;9(11):e112420. doi: 10.1371/journal.pone.0112420. eCollection 2014.","PLoS One.  2014","PubMed","citation","PMID:25375103 | PMCID:PMC4223053","pubmed","25375103","create date:2014/11/07 | first author:Cornman RS",
"Characterization and expression analysis of microRNAs in the tube foot of sea cucumber Apostichopus japonicus.","/pubmed/25372871","Wang H, Liu S, Cui J, Li C, Qiu X, Chang Y, Liu Z, Wang X.","PLoS One. 2014 Nov 5;9(11):e111820. doi: 10.1371/journal.pone.0111820. eCollection 2014.","PLoS One.  2014","PubMed","citation","PMID:25372871 | PMCID:PMC4221132","pubmed","25372871","create date:2014/11/06 | first author:Wang H",
"A tyrosine-rich cell surface protein in the diatom Amphora coffeaeformis identified through transcriptome analysis and genetic transformation.","/pubmed/25372470","Buhmann MT, Poulsen N, Klemm J, Kennedy MR, Sherrill CD, Kröger N.","PLoS One. 2014 Nov 5;9(11):e110369. doi: 10.1371/journal.pone.0110369. eCollection 2014.","PLoS One.  2014","PubMed","citation","PMID:25372470 | PMCID:PMC4220933","pubmed","25372470","create date:2014/11/06 | first author:Buhmann MT",
"17β-estradiol modulates gene expression in the female mouse cerebral cortex.","/pubmed/25372139","Humphreys GI, Ziegler YS, Nardulli AM.","PLoS One. 2014 Nov 5;9(11):e111975. doi: 10.1371/journal.pone.0111975. eCollection 2014.","PLoS One.  2014","PubMed","citation","PMID:25372139 | PMCID:PMC4221195","pubmed","25372139","create date:2014/11/06 | first author:Humphreys GI",
"CARD14 expression in dermal endothelial cells in psoriasis.","/pubmed/25369198","Harden JL, Lewis SM, Pierson KC, Suárez-Fariñas M, Lentini T, Ortenzio FS, Zaba LC, Goldbach-Mansky R, Bowcock AM, Lowes MA.","PLoS One. 2014 Nov 4;9(11):e111255. doi: 10.1371/journal.pone.0111255. eCollection 2014.","PLoS One.  2014","PubMed","citation","PMID:25369198 | PMCID:PMC4219711","pubmed","25369198","create date:2014/11/05 | first author:Harden JL",
