Title,URL,Description,Details,ShortDetails,Resource,Type,Identifiers,Db,EntrezUID,Properties
"Distinct transcriptomic responses of Caenorhabditis elegans to pristine and sulfidized silver nanoparticles.","/pubmed/26925754","Starnes DL, Lichtenberg SS, Unrine JM, Starnes CP, Oostveen EK, Lowry GV, Bertsch PM, Tsyusko OV.","Environ Pollut. 2016 Jun;213:314-321. doi: 10.1016/j.envpol.2016.01.020. Epub 2016 Feb 27.","Environ Pollut.  2016","PubMed","citation","PMID:26925754","pubmed","26925754","create date:2016/03/02 | first author:Starnes DL",
"Spider phylogenomics: untangling the Spider Tree of Life.","/pubmed/26925338","Garrison NL, Rodriguez J, Agnarsson I, Coddington JA, Griswold CE, Hamilton CA, Hedin M, Kocot KM, Ledford JM, Bond JE.","PeerJ. 2016 Feb 23;4:e1719. doi: 10.7717/peerj.1719. eCollection 2016.","PeerJ.  2016","PubMed","citation","PMID:26925338 | PMCID:PMC4768681","pubmed","26925338","create date:2016/03/01 | first author:Garrison NL",
"RNA-Seq of the Caribbean reef-building coral Orbicella faveolata (Scleractinia-Merulinidae) under bleaching and disease stress expands models of coral innate immunity.","/pubmed/26925311","Anderson DA, Walz ME, Weil E, Tonellato P, Smith MC.","PeerJ. 2016 Feb 15;4:e1616. doi: 10.7717/peerj.1616. eCollection 2016.","PeerJ.  2016","PubMed","citation","PMID:26925311 | PMCID:PMC4768675","pubmed","26925311","create date:2016/03/01 | first author:Anderson DA",
"Transcriptome Analysis of Soybean Leaf Abscission Identifies Transcriptional Regulators of Organ Polarity and Cell Fate.","/pubmed/26925069","Kim J, Yang J, Yang R, Sicher RC, Chang C, Tucker ML.","Front Plant Sci. 2016 Feb 17;7:125. doi: 10.3389/fpls.2016.00125. eCollection 2016.","Front Plant Sci.  2016","PubMed","citation","PMID:26925069 | PMCID:PMC4756167","pubmed","26925069","create date:2016/03/01 | first author:Kim J",
"Decoding the RNA structurome.","/pubmed/26923056","Lu Z, Chang HY.","Curr Opin Struct Biol. 2016 Feb;36:142-8. doi: 10.1016/j.sbi.2016.01.007. Epub 2016 Feb 26. Review.","Curr Opin Struct Biol.  2016","PubMed","citation","PMID:26923056 | PMCID:PMC4785074","pubmed","26923056","create date:2016/03/01 | first author:Lu Z",
"Advances in Therapeutic Cancer Vaccines.","/pubmed/26923002","Wong KK, Li WA, Mooney DJ, Dranoff G.","Adv Immunol. 2016;130:191-249. doi: 10.1016/bs.ai.2015.12.001. Epub 2016 Jan 19. Review.","Adv Immunol.  2016","PubMed","citation","PMID:26923002","pubmed","26923002","create date:2016/03/01 | first author:Wong KK",
"Analysis of Transcriptional Signatures in Response to Listeria monocytogenes Infection Reveals Temporal Changes That Result from Type I Interferon Signaling.","/pubmed/26918359","Pitt JM, Blankley S, Potempa K, Graham CM, Moreira-Teixeira L, McNab FW, Howes A, Stavropoulos E, Pascual V, Banchereau J, Chaussabel D, O'Garra A.","PLoS One. 2016 Feb 26;11(2):e0150251. doi: 10.1371/journal.pone.0150251. eCollection 2016.","PLoS One.  2016","PubMed","citation","PMID:26918359 | PMCID:PMC4768944","pubmed","26918359","create date:2016/02/27 | first author:Pitt JM",
"Integrative Analysis of Multi-omics Data for Discovery and Functional Studies of Complex Human Diseases.","/pubmed/26915271","Sun YV, Hu YJ.","Adv Genet. 2016;93:147-90. doi: 10.1016/bs.adgen.2015.11.004. Epub 2016 Jan 25. Review.","Adv Genet.  2016","PubMed","citation","PMID:26915271","pubmed","26915271","create date:2016/02/27 | first author:Sun YV",
"Strong Components of Epigenetic Memory in Cultured Human Fibroblasts Related to Site of Origin and Donor Age.","/pubmed/26913521","Ivanov NA, Tao R, Chenoweth JG, Brandtjen A, Mighdoll MI, Genova JD, McKay RD, Jia Y, Weinberger DR, Kleinman JE, Hyde TM, Jaffe AE.","PLoS Genet. 2016 Feb 25;12(2):e1005819. doi: 10.1371/journal.pgen.1005819. eCollection 2016 Feb.","PLoS Genet.  2016","PubMed","citation","PMID:26913521 | PMCID:PMC4767228","pubmed","26913521","create date:2016/02/26 | first author:Ivanov NA",
"Profound Chemopreventative Effects of a Hydrogen Sulfide-Releasing NSAID in the APCMin/+ Mouse Model of Intestinal Tumorigenesis.","/pubmed/26910063","Paul-Clark M, Elsheikh W, Kirkby N, Chan M, Devchand P, Agbor TA, Flannigan KL, Cheadle C, Freydin M, Ianaro A, Mitchell JA, Wallace JL.","PLoS One. 2016 Feb 24;11(2):e0147289. doi: 10.1371/journal.pone.0147289. eCollection 2016.","PLoS One.  2016","PubMed","citation","PMID:26910063 | PMCID:PMC4766010","pubmed","26910063","create date:2016/02/26 | first author:Paul-Clark M",
"Transcriptional Profiling of Coxiella burnetii Reveals Extensive Cell Wall Remodeling in the Small Cell Variant Developmental Form.","/pubmed/26909555","Sandoz KM, Popham DL, Beare PA, Sturdevant DE, Hansen B, Nair V, Heinzen RA.","PLoS One. 2016 Feb 24;11(2):e0149957. doi: 10.1371/journal.pone.0149957. eCollection 2016.","PLoS One.  2016","PubMed","citation","PMID:26909555 | PMCID:PMC4766238","pubmed","26909555","create date:2016/02/26 | first author:Sandoz KM",
"Proteogenomic Analysis of a Hibernating Mammal Indicates Contribution of Skeletal Muscle Physiology to the Hibernation Phenotype.","/pubmed/26903422","Anderson KJ, Vermillion KL, Jagtap P, Johnson JE, Griffin TJ, Andrews MT.","J Proteome Res. 2016 Apr 1;15(4):1253-61. doi: 10.1021/acs.jproteome.5b01138. Epub 2016 Mar 3.","J Proteome Res.  2016","PubMed","citation","PMID:26903422","pubmed","26903422","create date:2016/02/24 | first author:Anderson KJ",
"Mating-Induced Transcriptome Changes in the Reproductive Tract of Female Aedes aegypti.","/pubmed/26901677","Alfonso-Parra C, Ahmed-Braimah YH, Degner EC, Avila FW, Villarreal SM, Pleiss JA, Wolfner MF, Harrington LC.","PLoS Negl Trop Dis. 2016 Feb 22;10(2):e0004451. doi: 10.1371/journal.pntd.0004451. eCollection 2016 Feb.","PLoS Negl Trop Dis.  2016","PubMed","citation","PMID:26901677 | PMCID:PMC4764262","pubmed","26901677","create date:2016/02/24 | first author:Alfonso-Parra C",
"BinPacker: Packing-Based De Novo Transcriptome Assembly from RNA-seq Data.","/pubmed/26894997","Liu J, Li G, Chang Z, Yu T, Liu B, McMullen R, Chen P, Huang X.","PLoS Comput Biol. 2016 Feb 19;12(2):e1004772. doi: 10.1371/journal.pcbi.1004772. eCollection 2016 Feb.","PLoS Comput Biol.  2016","PubMed","citation","PMID:26894997 | PMCID:PMC4760927","pubmed","26894997","create date:2016/02/20 | first author:Liu J",
"Transcriptome-Wide Analysis of Hepatitis B Virus-Mediated Changes to Normal Hepatocyte Gene Expression.","/pubmed/26891448","Lamontagne J, Mell JC, Bouchard MJ.","PLoS Pathog. 2016 Feb 18;12(2):e1005438. doi: 10.1371/journal.ppat.1005438. eCollection 2016 Feb.","PLoS Pathog.  2016","PubMed","citation","PMID:26891448 | PMCID:PMC4758756","pubmed","26891448","create date:2016/02/20 | first author:Lamontagne J",
"Genome-Wide Chromatin Landscape Transitions Identify Novel Pathways in Early Commitment to Osteoblast Differentiation.","/pubmed/26890492","Thompson B, Varticovski L, Baek S, Hager GL.","PLoS One. 2016 Feb 18;11(2):e0148619. doi: 10.1371/journal.pone.0148619. eCollection 2016.","PLoS One.  2016","PubMed","citation","PMID:26890492 | PMCID:PMC4759368","pubmed","26890492","create date:2016/02/20 | first author:Thompson B",
"Tetra-O-Methyl Nordihydroguaiaretic Acid Broadly Suppresses Cancer Metabolism and Synergistically Induces Strong Anticancer Activity in Combination with Etoposide, Rapamycin and UCN-01.","/pubmed/26886430","Kimura K, Huang RC.","PLoS One. 2016 Feb 17;11(2):e0148685. doi: 10.1371/journal.pone.0148685. eCollection 2016.","PLoS One.  2016","PubMed","citation","PMID:26886430 | PMCID:PMC4757551","pubmed","26886430","create date:2016/02/18 | first author:Kimura K",
"Proteinaceous Pheromone Homologs Identified from the Cloacal Gland Transcriptome of a Male Axolotl, Ambystoma mexicanum.","/pubmed/26885665","Hall KW, Eisthen HL, Williams BL.","PLoS One. 2016 Feb 17;11(2):e0146851. doi: 10.1371/journal.pone.0146851. eCollection 2016.","PLoS One.  2016","PubMed","citation","PMID:26885665 | PMCID:PMC4757389","pubmed","26885665","create date:2016/02/18 | first author:Hall KW",
"ZBIT Bioinformatics Toolbox: A Web-Platform for Systems Biology and Expression Data Analysis.","/pubmed/26882475","Römer M, Eichner J, Dräger A, Wrzodek C, Wrzodek F, Zell A.","PLoS One. 2016 Feb 16;11(2):e0149263. doi: 10.1371/journal.pone.0149263. eCollection 2016.","PLoS One.  2016","PubMed","citation","PMID:26882475 | PMCID:PMC4801062","pubmed","26882475","create date:2016/02/18 | first author:Römer M",
"Shoc2-tranduced ERK1/2 motility signals--Novel insights from functional genomics.","/pubmed/26876614","Jeoung M, Jang ER, Liu J, Wang C, Rouchka EC, Li X, Galperin E.","Cell Signal. 2016 May;28(5):448-459. doi: 10.1016/j.cellsig.2016.02.005. Epub 2016 Feb 11.","Cell Signal.  2016","PubMed","citation","PMID:26876614 | PMCID:PMC4788539","pubmed","26876614","create date:2016/02/16 | first author:Jeoung M",
"Developmental transcriptomics in Atlantic haddock: Illuminating pattern formation and organogenesis in non-model vertebrates.","/pubmed/26875497","Sørhus E, Incardona JP, Furmanek T, Jentoft S, Meier S, Edvardsen RB.","Dev Biol. 2016 Mar 15;411(2):301-13. doi: 10.1016/j.ydbio.2016.02.012. Epub 2016 Feb 12.","Dev Biol.  2016","PubMed","citation","PMID:26875497","pubmed","26875497","create date:2016/02/16 | first author:Sørhus E",
"Temporal Gene Expression Analysis and RNA Silencing of Single and Multiple Members of Gene Family in the Lone Star Tick Amblyomma americanum.","/pubmed/26872360","Bullard RL, Williams J, Karim S.","PLoS One. 2016 Feb 12;11(2):e0147966. doi: 10.1371/journal.pone.0147966. eCollection 2016.","PLoS One.  2016","PubMed","citation","PMID:26872360 | PMCID:PMC4752215","pubmed","26872360","create date:2016/02/13 | first author:Bullard RL",
"Identification of Targets of CUG-BP, Elav-Like Family Member 1 (CELF1) Regulation in Embryonic Heart Muscle.","/pubmed/26866591","Blech-Hermoni Y, Dasgupta T, Coram RJ, Ladd AN.","PLoS One. 2016 Feb 11;11(2):e0149061. doi: 10.1371/journal.pone.0149061. eCollection 2016.","PLoS One.  2016","PubMed","citation","PMID:26866591 | PMCID:PMC4750973","pubmed","26866591","create date:2016/02/13 | first author:Blech-Hermoni Y",
"Transcriptome Analysis of Chemically-Induced Sensory Neuron Ablation in Zebrafish.","/pubmed/26863206","Cox JA, Zhang B, Pope HM, Voigt MM.","PLoS One. 2016 Feb 10;11(2):e0148726. doi: 10.1371/journal.pone.0148726. eCollection 2016.","PLoS One.  2016","PubMed","citation","PMID:26863206 | PMCID:PMC4749159","pubmed","26863206","create date:2016/02/11 | first author:Cox JA",
"DAF-16 and TCER-1 Facilitate Adaptation to Germline Loss by Restoring Lipid Homeostasis and Repressing Reproductive Physiology in C. elegans.","/pubmed/26862916","Amrit FR, Steenkiste EM, Ratnappan R, Chen SW, McClendon TB, Kostka D, Yanowitz J, Olsen CP, Ghazi A.","PLoS Genet. 2016 Feb 10;12(2):e1005788. doi: 10.1371/journal.pgen.1005788. eCollection 2016 Feb. Erratum in: PLoS Genet. 2016 Oct 7;12 (10 ):e1006381. ","PLoS Genet.  2016","PubMed","citation","PMID:26862916 | PMCID:PMC4749232","pubmed","26862916","create date:2016/02/11 | first author:Amrit FR",
"Transcriptomics Modeling of the Late-Gestation Fetal Pituitary Response to Transient Hypoxia.","/pubmed/26859870","Wood CE, Chang EI, Richards EM, Rabaglino MB, Keller-Wood M.","PLoS One. 2016 Feb 9;11(2):e0148465. doi: 10.1371/journal.pone.0148465. eCollection 2016.","PLoS One.  2016","PubMed","citation","PMID:26859870 | PMCID:PMC4747542","pubmed","26859870","create date:2016/02/10 | first author:Wood CE",
"Hepatic transcriptomic and metabolic responses of hybrid striped bass (Morone saxatilis×Morone chrysops) to acute and chronic hypoxic insult.","/pubmed/26851735","Beck BH, Fuller SA, Li C, Green BW, Zhao H, Rawles SD, Webster CD, Peatman E.","Comp Biochem Physiol Part D Genomics Proteomics. 2016 Jun;18:1-9. doi: 10.1016/j.cbd.2016.01.005. Epub 2016 Jan 21.","Comp Biochem Physiol Part D Genomics Proteomics.  2016","PubMed","citation","PMID:26851735","pubmed","26851735","create date:2016/02/07 | first author:Beck BH",
"Molecular and Cellular Profiling of Scalp Psoriasis Reveals Differences and Similarities Compared to Skin Psoriasis.","/pubmed/26849645","Ruano J, Suárez-Fariñas M, Shemer A, Oliva M, Guttman-Yassky E, Krueger JG.","PLoS One. 2016 Feb 5;11(2):e0148450. doi: 10.1371/journal.pone.0148450. eCollection 2016.","PLoS One.  2016","PubMed","citation","PMID:26849645 | PMCID:PMC4743842","pubmed","26849645","create date:2016/02/06 | first author:Ruano J",
"Transcriptome Profiling of Beach Morning Glory (Ipomoea imperati) under Salinity and Its Comparative Analysis with Sweetpotato.","/pubmed/26848754","Solis J, Baisakh N, Brandt SR, Villordon A, La Bonte D.","PLoS One. 2016 Feb 5;11(2):e0147398. doi: 10.1371/journal.pone.0147398. eCollection 2016.","PLoS One.  2016","PubMed","citation","PMID:26848754 | PMCID:PMC4743971","pubmed","26848754","create date:2016/02/06 | first author:Solis J",
"Transcriptional Profiling the 150 kb Linear Megaplasmid of Borrelia turicatae Suggests a Role in Vector Colonization and Initiating Mammalian Infection.","/pubmed/26845332","Wilder HK, Raffel SJ, Barbour AG, Porcella SF, Sturdevant DE, Vaisvil B, Kapatral V, Schmitt DP, Schwan TG, Lopez JE.","PLoS One. 2016 Feb 4;11(2):e0147707. doi: 10.1371/journal.pone.0147707. eCollection 2016.","PLoS One.  2016","PubMed","citation","PMID:26845332 | PMCID:PMC4741519","pubmed","26845332","create date:2016/02/06 | first author:Wilder HK",
"Use of De Novo Transcriptome Libraries to Characterize a Novel Oleaginous Marine Chlorella Species during the Accumulation of Triacylglycerols.","/pubmed/26840425","Mansfeldt CB, Richter LV, Ahner BA, Cochlan WP, Richardson RE.","PLoS One. 2016 Feb 3;11(2):e0147527. doi: 10.1371/journal.pone.0147527. eCollection 2016.","PLoS One.  2016","PubMed","citation","PMID:26840425 | PMCID:PMC4740408","pubmed","26840425","create date:2016/02/04 | first author:Mansfeldt CB",
"Transcriptome Analysis of Targeted Mouse Mutations Reveals the Topography of Local Changes in Gene Expression.","/pubmed/26839965","West DB, Engelhard EK, Adkisson M, Nava AJ, Kirov JV, Cipollone A, Willis B, Rapp J, de Jong PJ, Lloyd KC.","PLoS Genet. 2016 Feb 3;12(2):e1005691. doi: 10.1371/journal.pgen.1005691. eCollection 2016 Feb.","PLoS Genet.  2016","PubMed","citation","PMID:26839965 | PMCID:PMC4739719","pubmed","26839965","create date:2016/02/04 | first author:West DB",
"De novo Transcriptome Sequencing and Development of Abscission Zone-Specific Microarray as a New Molecular Tool for Analysis of Tomato Organ Abscission.","/pubmed/26834766","Sundaresan S, Philosoph-Hadas S, Riov J, Mugasimangalam R, Kuravadi NA, Kochanek B, Salim S, Tucker ML, Meir S.","Front Plant Sci. 2016 Jan 14;6:1258. doi: 10.3389/fpls.2015.01258. eCollection 2015.","Front Plant Sci.  2015","PubMed","citation","PMID:26834766 | PMCID:PMC4712312","pubmed","26834766","create date:2016/02/03 | first author:Sundaresan S",
"A new view of transcriptome complexity and regulation through the lens of local splicing variations.","/pubmed/26829591","Vaquero-Garcia J, Barrera A, Gazzara MR, González-Vallinas J, Lahens NF, Hogenesch JB, Lynch KW, Barash Y.","Elife. 2016 Feb 1;5:e11752. doi: 10.7554/eLife.11752.","Elife.  2016","PubMed","citation","PMID:26829591 | PMCID:PMC4801060","pubmed","26829591","create date:2016/02/02 | first author:Vaquero-Garcia J",
"ABA Is Required for Plant Acclimation to a Combination of Salt and Heat Stress.","/pubmed/26824246","Suzuki N, Bassil E, Hamilton JS, Inupakutika MA, Zandalinas SI, Tripathy D, Luo Y, Dion E, Fukui G, Kumazaki A, Nakano R, Rivero RM, Verbeck GF, Azad RK, Blumwald E, Mittler R.","PLoS One. 2016 Jan 29;11(1):e0147625. doi: 10.1371/journal.pone.0147625. eCollection 2016.","PLoS One.  2016","PubMed","citation","PMID:26824246 | PMCID:PMC4733103","pubmed","26824246","create date:2016/01/30 | first author:Suzuki N",
"Characterizing Molecular Mechanisms of Imidacloprid Resistance in Select Populations of Leptinotarsa decemlineata in the Central Sands Region of Wisconsin.","/pubmed/26821361","Clements J, Schoville S, Peterson N, Lan Q, Groves RL.","PLoS One. 2016 Jan 28;11(1):e0147844. doi: 10.1371/journal.pone.0147844. eCollection 2016.","PLoS One.  2016","PubMed","citation","PMID:26821361 | PMCID:PMC4731083","pubmed","26821361","create date:2016/01/29 | first author:Clements J",
Title,URL,Description,Details,ShortDetails,Resource,Type,Identifiers,Db,EntrezUID,Properties
"Analysis of Host Gene Expression Profile in HIV-1 and HIV-2 Infected T-Cells.","/pubmed/26821323","Devadas K, Biswas S, Haleyurgirisetty M, Wood O, Ragupathy V, Lee S, Hewlett I.","PLoS One. 2016 Jan 28;11(1):e0147421. doi: 10.1371/journal.pone.0147421. eCollection 2016.","PLoS One.  2016","PubMed","citation","PMID:26821323 | PMCID:PMC4731573","pubmed","26821323","create date:2016/01/29 | first author:Devadas K",
"A Study of Alterations in DNA Epigenetic Modifications (5mC and 5hmC) and Gene Expression Influenced by Simulated Microgravity in Human Lymphoblastoid Cells.","/pubmed/26820575","Chowdhury B, Seetharam A, Wang Z, Liu Y, Lossie AC, Thimmapuram J, Irudayaraj J.","PLoS One. 2016 Jan 28;11(1):e0147514. doi: 10.1371/journal.pone.0147514. eCollection 2016.","PLoS One.  2016","PubMed","citation","PMID:26820575 | PMCID:PMC4731572","pubmed","26820575","create date:2016/01/29 | first author:Chowdhury B",
"Revisiting the Zingiberales: using multiplexed exon capture to resolve ancient and recent phylogenetic splits in a charismatic plant lineage.","/pubmed/26819846","Sass C, Iles WJ, Barrett CF, Smith SY, Specht CD.","PeerJ. 2016 Jan 21;4:e1584. doi: 10.7717/peerj.1584. eCollection 2016.","PeerJ.  2016","PubMed","citation","PMID:26819846 | PMCID:PMC4727956","pubmed","26819846","create date:2016/01/29 | first author:Sass C",
"Expression patterns of cysteine peptidase genes across the Tribolium castaneum life cycle provide clues to biological function.","/pubmed/26819843","Perkin L, Elpidina EN, Oppert B.","PeerJ. 2016 Jan 18;4:e1581. doi: 10.7717/peerj.1581. eCollection 2016.","PeerJ.  2016","PubMed","citation","PMID:26819843 | PMCID:PMC4727968","pubmed","26819843","create date:2016/01/29 | first author:Perkin L",
"Association between early promoter-specific DNA methylation changes and outcome in older acute myeloid leukemia patients.","/pubmed/26818573","Achille NJ, Othus M, Phelan K, Zhang S, Cooper K, Godwin JE, Appelbaum FR, Radich JP, Erba HP, Nand S, Zeleznik-Le NJ.","Leuk Res. 2016 Mar;42:68-74. doi: 10.1016/j.leukres.2016.01.004. Epub 2016 Jan 15.","Leuk Res.  2016","PubMed","citation","PMID:26818573 | PMCID:PMC4779662","pubmed","26818573","create date:2016/01/29 | first author:Achille NJ",
"Virulent Diuraphis noxia Aphids Over-Express Calcium Signaling Proteins to Overcome Defenses of Aphid-Resistant Wheat Plants.","/pubmed/26815857","Sinha DK, Chandran P, Timm AE, Aguirre-Rojas L, Smith CM.","PLoS One. 2016 Jan 27;11(1):e0146809. doi: 10.1371/journal.pone.0146809. eCollection 2016.","PLoS One.  2016","PubMed","citation","PMID:26815857 | PMCID:PMC4729530","pubmed","26815857","create date:2016/01/28 | first author:Sinha DK",
"Identification of Genes Relevant to Pesticides and Biology from Global Transcriptome Data of Monochamus alternatus Hope (Coleoptera: Cerambycidae) Larvae.","/pubmed/26815657","Wu S, Zhu X, Liu Z, Shao E, Rebeca CL, Guo Y, Xiong Y, Mou Y, Xu R, Hu X, Liang G, Zou S, Guan X, Zhang F.","PLoS One. 2016 Jan 27;11(1):e0147855. doi: 10.1371/journal.pone.0147855. eCollection 2016.","PLoS One.  2016","PubMed","citation","PMID:26815657 | PMCID:PMC4729689","pubmed","26815657","create date:2016/01/28 | first author:Wu S",
"The Phenazine 2-Hydroxy-Phenazine-1-Carboxylic Acid Promotes Extracellular DNA Release and Has Broad Transcriptomic Consequences in Pseudomonas chlororaphis 30-84.","/pubmed/26812402","Wang D, Yu JM, Dorosky RJ, Pierson LS 3rd, Pierson EA.","PLoS One. 2016 Jan 26;11(1):e0148003. doi: 10.1371/journal.pone.0148003. eCollection 2016.","PLoS One.  2016","PubMed","citation","PMID:26812402 | PMCID:PMC4727817","pubmed","26812402","create date:2016/01/27 | first author:Wang D",
"RNA-sequencing study of peripheral blood monocytes in chronic periodontitis.","/pubmed/26812355","Liu YZ, Maney P, Puri J, Zhou Y, Baddoo M, Strong M, Wang YP, Flemington E, Deng HW.","Gene. 2016 May 1;581(2):152-60. doi: 10.1016/j.gene.2016.01.036. Epub 2016 Jan 23.","Gene.  2016","PubMed","citation","PMID:26812355 | PMCID:PMC4767619","pubmed","26812355","create date:2016/01/27 | first author:Liu YZ",
"A phylotranscriptomic analysis of gene family expansion and evolution in the largest order of pleurocarpous mosses (Hypnales, Bryophyta).","/pubmed/26811877","Johnson MG, Malley C, Goffinet B, Shaw AJ, Wickett NJ.","Mol Phylogenet Evol. 2016 May;98:29-40. doi: 10.1016/j.ympev.2016.01.008. Epub 2016 Jan 23.","Mol Phylogenet Evol.  2016","PubMed","citation","PMID:26811877","pubmed","26811877","create date:2016/01/27 | first author:Johnson MG",
"Estrogen Receptor Alpha (ESR1)-Dependent Regulation of the Mouse Oviductal Transcriptome.","/pubmed/26808832","Cerny KL, Ribeiro RA, Jeoung M, Ko C, Bridges PJ.","PLoS One. 2016 Jan 25;11(1):e0147685. doi: 10.1371/journal.pone.0147685. eCollection 2016.","PLoS One.  2016","PubMed","citation","PMID:26808832 | PMCID:PMC4725743","pubmed","26808832","create date:2016/01/26 | first author:Cerny KL",
"Meta-Analyses of Microarray Datasets Identifies ANO1 and FADD as Prognostic Markers of Head and Neck Cancer.","/pubmed/26808319","Reddy RB, Bhat AR, James BL, Govindan SV, Mathew R, Ravindra DR, Hedne N, Illiayaraja J, Kekatpure V, Khora SS, Hicks W, Tata P, Kuriakose MA, Suresh A.","PLoS One. 2016 Jan 25;11(1):e0147409. doi: 10.1371/journal.pone.0147409. eCollection 2016.","PLoS One.  2016","PubMed","citation","PMID:26808319 | PMCID:PMC4726811","pubmed","26808319","create date:2016/01/26 | first author:Reddy RB",
"Post-transcriptional Control of Tumor Cell Autonomous Metastatic Potential by CCR4-NOT Deadenylase CNOT7.","/pubmed/26807845","Faraji F, Hu Y, Yang HH, Lee MP, Winkler GS, Hafner M, Hunter KW.","PLoS Genet. 2016 Jan 25;12(1):e1005820. doi: 10.1371/journal.pgen.1005820. eCollection 2016 Jan.","PLoS Genet.  2016","PubMed","citation","PMID:26807845 | PMCID:PMC4726497","pubmed","26807845","create date:2016/01/26 | first author:Faraji F",
"Transcriptomic Determinants of Scrapie Prion Propagation in Cultured Ovine Microglia.","/pubmed/26807844","Muñoz-Gutiérrez JF, Pierlé SA, Schneider DA, Baszler TV, Stanton JB.","PLoS One. 2016 Jan 25;11(1):e0147727. doi: 10.1371/journal.pone.0147727. eCollection 2016.","PLoS One.  2016","PubMed","citation","PMID:26807844 | PMCID:PMC4726464","pubmed","26807844","create date:2016/01/26 | first author:Muñoz-Gutiérrez JF",
"Insight into the Salivary Gland Transcriptome of Lygus lineolaris (Palisot de Beauvois).","/pubmed/26789269","Showmaker KC, Bednářová A, Gresham C, Hsu CY, Peterson DG, Krishnan N.","PLoS One. 2016 Jan 20;11(1):e0147197. doi: 10.1371/journal.pone.0147197. eCollection 2016.","PLoS One.  2016","PubMed","citation","PMID:26789269 | PMCID:PMC4720363","pubmed","26789269","create date:2016/01/21 | first author:Showmaker KC",
"In planta comparative transcriptomics of host-adapted strains of Ralstonia solanacearum.","/pubmed/26788428","Ailloud F, Lowe TM, Robène I, Cruveiller S, Allen C, Prior P.","PeerJ. 2016 Jan 5;4:e1549. doi: 10.7717/peerj.1549. eCollection 2016.","PeerJ.  2016","PubMed","citation","PMID:26788428 | PMCID:PMC4715432","pubmed","26788428","create date:2016/01/21 | first author:Ailloud F",
"Genetic Signature of Resistance to White Band Disease in the Caribbean Staghorn Coral Acropora cervicornis.","/pubmed/26784329","Libro S, Vollmer SV.","PLoS One. 2016 Jan 19;11(1):e0146636. doi: 10.1371/journal.pone.0146636. eCollection 2016.","PLoS One.  2016","PubMed","citation","PMID:26784329 | PMCID:PMC4718514","pubmed","26784329","create date:2016/01/20 | first author:Libro S",
"Whole genome and normalized mRNA sequencing reveal genetic status of TK6, WTK1, and NH32 human B-lymphoblastoid cell lines.","/pubmed/26774668","Revollo J, Petibone DM, McKinzie P, Knox B, Morris SM, Ning B, Dobrovolsky VN.","Mutat Res Genet Toxicol Environ Mutagen. 2016 Jan 1;795:60-9. doi: 10.1016/j.mrgentox.2015.11.006. Epub 2015 Nov 17.","Mutat Res Genet Toxicol Environ Mutagen.  2016","PubMed","citation","PMID:26774668","pubmed","26774668","create date:2016/01/18 | first author:Revollo J",
"A new perspective on microbial landscapes within food production.","/pubmed/26773388","Bokulich NA, Lewis ZT, Boundy-Mills K, Mills DA.","Curr Opin Biotechnol. 2016 Feb;37:182-189. doi: 10.1016/j.copbio.2015.12.008. Epub 2016 Jan 11. Review.","Curr Opin Biotechnol.  2016","PubMed","citation","PMID:26773388 | PMCID:PMC4913695","pubmed","26773388","create date:2016/01/17 | first author:Bokulich NA",
"Early Regulation of Profibrotic Genes in Primary Human Cardiac Myocytes by Trypanosoma cruzi.","/pubmed/26771187","Udoko AN, Johnson CA, Dykan A, Rachakonda G, Villalta F, Mandape SN, Lima MF, Pratap S, Nde PN.","PLoS Negl Trop Dis. 2016 Jan 15;10(1):e0003747. doi: 10.1371/journal.pntd.0003747. eCollection 2016 Jan.","PLoS Negl Trop Dis.  2016","PubMed","citation","PMID:26771187 | PMCID:PMC4714843","pubmed","26771187","create date:2016/01/16 | first author:Udoko AN",
"Genetic Diversity Affects the Daily Transcriptional Oscillations of Marine Microbial Populations.","/pubmed/26751368","Shilova IN, Robidart JC, DeLong EF, Zehr JP.","PLoS One. 2016 Jan 11;11(1):e0146706. doi: 10.1371/journal.pone.0146706. eCollection 2016.","PLoS One.  2016","PubMed","citation","PMID:26751368 | PMCID:PMC4709009","pubmed","26751368","create date:2016/01/12 | first author:Shilova IN",
